19:50:19.810287 IP 167.99.191.180.22 > 198.211.111.194.56162: Flags [P.], seq 1946413449:1946413577, ack 1079911593, win 501, options [nop,nop,TS val 3599758355 ecr 3971500945], length 128
19:50:19.810354 IP 167.99.191.180.22 > 198.211.111.194.56162: Flags [P.], seq 128:192, ack 1, win 501, options [nop,nop,TS val 3599758355 ecr 3971500945], length 64
19:50:19.810375 IP 167.99.191.180.22 > 198.211.111.194.56162: Flags [P.], seq 192:272, ack 1, win 501, options [nop,nop,TS val 3599758355 ecr 3971500945], length 80
19:50:19.810406 IP 167.99.191.180.22 > 198.211.111.194.56162: Flags [P.], seq 272:352, ack 1, win 501, options [nop,nop,TS val 3599758355 ecr 3971500945], length 80
19:50:19.810435 IP 167.99.191.180.22 > 198.211.111.194.56162: Flags [P.], seq 352:432, ack 1, win 501, options [nop,nop,TS val 3599758355 ecr 3971500945], length 80
19:50:19.810461 IP 167.99.191.180.22 > 198.211.111.194.56162: Flags [P.], seq 432:496, ack 1, win 501, options [nop,nop,TS val 3599758355 ecr 3971500945], length 64
19:50:19.820812 IP 198.211.111.194.56162 > 167.99.191.180.22: Flags [.], ack 0, win 501, options [nop,nop,TS val 3971500962 ecr 3599758352], length 0
19:50:19.824469 IP 198.211.111.194.56162 > 167.99.191.180.22: Flags [.], ack 128, win 501, options [nop,nop,TS val 3971500966 ecr 3599758355], length 0
19:50:19.824469 IP 198.211.111.194.56162 > 167.99.191.180.22: Flags [.], ack 192, win 501, options [nop,nop,TS val 3971500966 ecr 3599758355], length 0
19:50:19.824469 IP 198.211.111.194.56162 > 167.99.191.180.22: Flags [.], ack 272, win 501, options [nop,nop,TS val 3971500966 ecr 3599758355], length 0
19:50:19.824516 IP 198.211.111.194.56162 > 167.99.191.180.22: Flags [.], ack 352, win 501, options [nop,nop,TS val 3971500966 ecr 3599758355], length 0
19:50:19.824546 IP 198.211.111.194.56162 > 167.99.191.180.22: Flags [.], ack 432, win 501, options [nop,nop,TS val 3971500966 ecr 3599758355], length 0
19:50:19.824546 IP 198.211.111.194.56162 > 167.99.191.180.22: Flags [.], ack 496, win 501, options [nop,nop,TS val 3971500966 ecr 3599758355], length 0
19:50:21.603008 IP 79.124.40.82.50498 > 167.99.191.180.21332: Flags [S], seq 1257666203, win 1025, options [mss 1460], length 0
19:50:23.457677 IP 198.211.111.194.56162 > 167.99.191.180.22: Flags [P.], seq 1:33, ack 496, win 501, options [nop,nop,TS val 3971504599 ecr 3599758355], length 32
19:50:23.457678 IP 198.211.111.194.56162 > 167.99.191.180.22: Flags [P.], seq 33:65, ack 496, win 501, options [nop,nop,TS val 3971504599 ecr 3599758355], length 32
19:50:23.457807 IP 167.99.191.180.22 > 198.211.111.194.56162: Flags [.], ack 65, win 501, options [nop,nop,TS val 3599762003 ecr 3971504599], length 0
19:50:23.457928 IP 167.99.191.180.22 > 198.211.111.194.56162: Flags [P.], seq 496:560, ack 65, win 501, options [nop,nop,TS val 3599762003 ecr 3971504599], length 64
19:50:23.472113 IP 198.211.111.194.56162 > 167.99.191.180.22: Flags [.], ack 560, win 501, options [nop,nop,TS val 3971504613 ecr 3599762003], length 0

