19:47:12.963633 IP lamponubuntu2204-s-1vcpu-1gb-tor1-01.ssh > 198.211.111.194.56162: Flags [P.], seq 1946364969:1946365033, ack 1079893673, win 502, options [nop,nop,TS val 3599571509 ecr 3971314099], length 64
E..t.L@.@..z.c....o....bt.,)@].............
...5..q...]r.......
.d....G.9.G}..Y.)
.........{\....R"...4..x...u.F..."
19:47:12.965782 IP lamponubuntu2204-s-1vcpu-1gb-tor1-01.ssh > 198.211.111.194.56162: Flags [P.], seq 64:192, ack 1, win 502, options [nop,nop,TS val 3599571511 ecr 3971314099], length 128
E....M@.@..9.c....o....bt.,i@].......T.....
...7..q....Bn_..x+..2...T..(.."..4Q.]...8...?..b.....)...4.....r!...1,.z].j..:>}...@..|....j..g..Z..-..&...J..+t-..F.n.,'.T.`.JG...Z...W
19:47:12.965846 IP lamponubuntu2204-s-1vcpu-1gb-tor1-01.ssh > 198.211.111.194.56162: Flags [P.], seq 192:256, ack 1, win 502, options [nop,nop,TS val 3599571511 ecr 3971314099], length 64
E..t.N@.@..x.c....o....bt.,.@].............
...7..q.....N2..?.."...@...-....#>..<w.LB..1.....1....7.t...?...pa9).XB.
19:47:12.965877 IP lamponubuntu2204-s-1vcpu-1gb-tor1-01.ssh > 198.211.111.194.56162: Flags [P.], seq 256:336, ack 1, win 502, options [nop,nop,TS val 3599571511 ecr 3971314099], length 80
E....O@.@..g.c....o....bt.-)@].......$.....
...7..q...`.l.Z...5.f...........6.!?....U6Q4H...i.;........+..#...?.........#.}`1.......
19:47:12.965908 IP lamponubuntu2204-s-1vcpu-1gb-tor1-01.ssh > 198.211.111.194.56162: Flags [P.], seq 336:416, ack 1, win 502, options [nop,nop,TS val 3599571511 ecr 3971314099], length 80
E....P@.@..f.c....o....bt.-y@].......$.....
...7..q.a...#....a......MW.*...s=...eX+..bQ.nf.......y.o.))~[I	.:.\.f...T...b?...mH..nB.
19:47:12.965943 IP lamponubuntu2204-s-1vcpu-1gb-tor1-01.ssh > 198.211.111.194.56162: Flags [P.], seq 416:496, ack 1, win 502, options [nop,nop,TS val 3599571511 ecr 3971314099], length 80
E....Q@.@..e.c....o....bt.-.@].......$.....
...7..q.Y.@..3.C....B.....q.4..[........%...>...^0....2.nOFq.A.....m...L	.....hp....W!nB
19:47:12.965968 IP lamponubuntu2204-s-1vcpu-1gb-tor1-01.ssh > 198.211.111.194.56162: Flags [P.], seq 496:560, ack 1, win 502, options [nop,nop,TS val 3599571511 ecr 3971314099], length 64
E..t.R@.@..t.c....o....bt...@].............
...7..q.7..#..4..w1...?.0.O..^=...(..#!....#.%.......z....\".Q...!.B8.F.
19:47:12.977827 IP 198.211.111.194.56162 > lamponubuntu2204-s-1vcpu-1gb-tor1-01.ssh: Flags [.], ack 64, win 501, options [nop,nop,TS val 3971314119 ecr 3599571509], length 0
E..4.k@.5.....o..c...b..@]..t.,i...........
..q....5
19:47:12.980026 IP 198.211.111.194.56162 > lamponubuntu2204-s-1vcpu-1gb-tor1-01.ssh: Flags [.], ack 192, win 501, options [nop,nop,TS val 3971314121 ecr 3599571511], length 0
E..4.l@.5.....o..c...b..@]..t.,......i.....
..q....7
19:47:12.980194 IP 198.211.111.194.56162 > lamponubuntu2204-s-1vcpu-1gb-tor1-01.ssh: Flags [.], ack 256, win 501, options [nop,nop,TS val 3971314122 ecr 3599571511], length 0
E..4.m@.5.....o..c...b..@]..t.-).....(.....
..q....7
19:47:12.980194 IP 198.211.111.194.56162 > lamponubuntu2204-s-1vcpu-1gb-tor1-01.ssh: Flags [.], ack 336, win 501, options [nop,nop,TS val 3971314122 ecr 3599571511], length 0
E..4.n@.5.....o..c...b..@]..t.-y...........
..q....7
19:47:12.980194 IP 198.211.111.194.56162 > lamponubuntu2204-s-1vcpu-1gb-tor1-01.ssh: Flags [.], ack 416, win 501, options [nop,nop,TS val 3971314122 ecr 3599571511], length 0
E..4.o@.5.....o..c...b..@]..t.-............
..q....7
19:47:12.980194 IP 198.211.111.194.56162 > lamponubuntu2204-s-1vcpu-1gb-tor1-01.ssh: Flags [.], ack 496, win 501, options [nop,nop,TS val 3971314122 ecr 3599571511], length 0
E..4.p@.5.....o..c...b..@]..t........8.....
..q....7
19:47:12.980194 IP 198.211.111.194.56162 > lamponubuntu2204-s-1vcpu-1gb-tor1-01.ssh: Flags [.], ack 560, win 501, options [nop,nop,TS val 3971314122 ecr 3599571511], length 0
E..4.q@.5.....o..c...b..@]..t..Y...........
..q....7
19:47:13.971370 IP lamponubuntu2204-s-1vcpu-1gb-tor1-01.33008 > 67.207.67.2.domain: 45499+ [1au] PTR? 194.111.211.198.in-addr.arpa. (57)
E..U....@....c..C.C....5.A.;.............194.111.211.198.in-addr.arpa.......)........
19:47:13.971522 IP lamponubuntu2204-s-1vcpu-1gb-tor1-01.59345 > 67.207.67.2.domain: 33379+ [1au] PTR? 194.111.211.198.in-addr.arpa. (57)
E..U.c..@..K.c..C.C....5.A.;.c...........194.111.211.198.in-addr.arpa.......)........
19:47:13.971579 IP lamponubuntu2204-s-1vcpu-1gb-tor1-01.38514 > 67.207.67.3.domain: Flags [S], seq 4012140935, win 64240, options [mss 1460,sackOK,TS val 3498912958 ecr 0,nop,wscale 7,tfo  cookiereq,nop,nop], length 0
E..@.h@.@..e.c..C.C..r.5.$i....................
..,........."...
19:47:13.972177 IP 67.207.67.3.domain > lamponubuntu2204-s-1vcpu-1gb-tor1-01.38514: Flags [S.], seq 975772220, ack 4012140936, win 65160, options [mss 1460,sackOK,TS val 801249857 ecr 3498912958,nop,wscale 9], length 0
E..<..@.<.P.C.C..c...5.r:).<.$i......q.........
/..A..,....	
19:47:13.972230 IP lamponubuntu2204-s-1vcpu-1gb-tor1-01.38514 > 67.207.67.3.domain: Flags [.], ack 1, win 502, options [nop,nop,TS val 3498912958 ecr 801249857], length 0
E..4.i@.@..p.c..C.C..r.5.$i.:).=...........
..,./..A
19:47:13.972280 IP lamponubuntu2204-s-1vcpu-1gb-tor1-01.38514 > 67.207.67.3.domain: Flags [P.], seq 1:49, ack 1, win 502, options [nop,nop,TS val 3498912958 ecr 801249857], length 48 3920+ PTR? 194.111.211.198.in-addr.arpa. (46)
E..d.j@.@..?.c..C.C..r.5.$i.:).=.....@.....
..,./..A...P...........194.111.211.198.in-addr.arpa.....
19:47:13.972596 IP 67.207.67.3.domain > lamponubuntu2204-s-1vcpu-1gb-tor1-01.38514: Flags [.], ack 49, win 128, options [nop,nop,TS val 801249857 ecr 3498912958], length 0
E..4(O@.<.(.C.C..c...5.r:).=.$i............
/..A..,.
19:47:13.972768 IP 67.207.67.3.domain > lamponubuntu2204-s-1vcpu-1gb-tor1-01.38514: Flags [P.], seq 1:116, ack 49, win 128, options [nop,nop,TS val 801249857 ecr 3498912958], length 115 3920 NXDomain 0/1/0 (113)
E...(P@.<.(.C.C..c...5.r:).=.$i......g.....
/..A..,..q.P...........194.111.211.198.in-addr.arpa................7.ns1.digitalocean.com.
hostmaster..Y..l..*0.....	:.....
19:47:13.972779 IP lamponubuntu2204-s-1vcpu-1gb-tor1-01.38514 > 67.207.67.3.domain: Flags [.], ack 116, win 502, options [nop,nop,TS val 3498912959 ecr 801249857], length 0
E..4.k@.@..n.c..C.C..r.5.$i.:).............
..,./..A
19:47:13.972943 IP 67.207.67.2.domain > lamponubuntu2204-s-1vcpu-1gb-tor1-01.33008: 45499 NXDomain 0/1/1 (124)
E....I..<.."C.C..c...5.....|.............194.111.211.198.in-addr.arpa................7.ns1.digitalocean.com.
hostmaster..Y..l..*0.....	:.......)........
19:47:13.972943 IP 67.207.67.2.domain > lamponubuntu2204-s-1vcpu-1gb-tor1-01.59345: 33379 NXDomain 0/1/1 (124)
E.......<...C.C..c...5....m$.c...........194.111.211.198.in-addr.arpa................7.ns1.digitalocean.com.
hostmaster..Y..l..*0.....	:.......)........
19:47:13.973241 IP lamponubuntu2204-s-1vcpu-1gb-tor1-01.33008 > 67.207.67.2.domain: 45499+ PTR? 194.111.211.198.in-addr.arpa. (46)
E..J....@....c..C.C....5.6.0.............194.111.211.198.in-addr.arpa.....
19:47:13.973307 IP lamponubuntu2204-s-1vcpu-1gb-tor1-01.59345 > 67.207.67.2.domain: 33379+ PTR? 194.111.211.198.in-addr.arpa. (46)
E..J.d..@..U.c..C.C....5.6.0.c...........194.111.211.198.in-addr.arpa.....
19:47:13.973559 IP 67.207.67.2.domain > lamponubuntu2204-s-1vcpu-1gb-tor1-01.33008: 45499 NXDomain 0/1/0 (113)
E....J..<..,C.C..c...5...y...............194.111.211.198.in-addr.arpa................7.ns1.digitalocean.com.
hostmaster..Y..l..*0.....	:.....
19:47:13.973737 IP 67.207.67.2.domain > lamponubuntu2204-s-1vcpu-1gb-tor1-01.59345: 33379 NXDomain 0/1/0 (113)
E.......<...C.C..c...5...yod.c...........194.111.211.198.in-addr.arpa................7.ns1.digitalocean.com.
hostmaster..Y..l..*0.....	:.....
19:47:13.974353 IP lamponubuntu2204-s-1vcpu-1gb-tor1-01.44282 > 67.207.67.2.domain: 40120+ [1au] PTR? 180.191.99.167.in-addr.arpa. (56)
E..T....@....c..C.C....5.@.:.............180.191.99.167.in-addr.arpa.......)........
19:47:13.974715 IP 67.207.67.2.domain > lamponubuntu2204-s-1vcpu-1gb-tor1-01.44282: 40120 NXDomain 0/1/1 (123)
E....K..<..!C.C..c...5....DN.............180.191.99.167.in-addr.arpa................7.ns1.digitalocean.com.
hostmaster..e.!...*0.....	:.......)........
19:47:13.974769 IP lamponubuntu2204-s-1vcpu-1gb-tor1-01.44282 > 67.207.67.2.domain: 40120+ PTR? 180.191.99.167.in-addr.arpa. (45)
E..I....@....c..C.C....5.5./.............180.191.99.167.in-addr.arpa.....
19:47:13.975039 IP 67.207.67.2.domain > lamponubuntu2204-s-1vcpu-1gb-tor1-01.44282: 40120 NXDomain 0/1/0 (112)
E....L..<..+C.C..c...5...xmg.............180.191.99.167.in-addr.arpa................7.ns1.digitalocean.com.
hostmaster..e.!...*0.....	:.....
19:47:14.995208 IP lamponubuntu2204-s-1vcpu-1gb-tor1-01.38268 > 67.207.67.2.domain: 52045+ [1au] PTR? 2.67.207.67.in-addr.arpa. (53)
E..Q.L..@..f.c..C.C..|.5.=.7.M...........2.67.207.67.in-addr.arpa.......)........
19:47:14.995337 IP lamponubuntu2204-s-1vcpu-1gb-tor1-01.52381 > 67.207.67.2.domain: 51759+ [1au] PTR? 2.67.207.67.in-addr.arpa. (53)
E..Q~...@....c..C.C....5.=.7./...........2.67.207.67.in-addr.arpa.......)........
19:47:14.995377 IP lamponubuntu2204-s-1vcpu-1gb-tor1-01.38514 > 67.207.67.3.domain: Flags [P.], seq 49:93, ack 116, win 502, options [nop,nop,TS val 3498913981 ecr 801249857], length 44 21148+ PTR? 2.67.207.67.in-addr.arpa. (42)
E..`.l@.@..A.c..C.C..r.5.$i.:).......<.....
..0./..A.*R............2.67.207.67.in-addr.arpa.....
19:47:14.995675 IP 67.207.67.2.domain > lamponubuntu2204-s-1vcpu-1gb-tor1-01.38268: 52045 NXDomain 0/1/1 (120)
E....{..<...C.C..c...5.|...p.M...........2.67.207.67.in-addr.arpa..............r.7.ns1.digitalocean.com.
hostmaster..Y.. ..*0.....	:.......)........
19:47:14.995778 IP 67.207.67.2.domain > lamponubuntu2204-s-1vcpu-1gb-tor1-01.52381: 51759 NXDomain 0/1/1 (120)
E....|..<...C.C..c...5.....m./...........2.67.207.67.in-addr.arpa..............r.7.ns1.digitalocean.com.
hostmaster..Y.. ..*0.....	:.......)........
19:47:14.995862 IP lamponubuntu2204-s-1vcpu-1gb-tor1-01.38268 > 67.207.67.2.domain: 52045+ PTR? 2.67.207.67.in-addr.arpa. (42)
E..F.M..@..p.c..C.C..|.5.2.,.M...........2.67.207.67.in-addr.arpa.....
19:47:14.995919 IP 67.207.67.3.domain > lamponubuntu2204-s-1vcpu-1gb-tor1-01.38514: Flags [P.], seq 116:227, ack 93, win 128, options [nop,nop,TS val 801250880 ecr 3498913981], length 111 21148 NXDomain 0/1/0 (109)
E...(Q@.<.(.C.C..c...5.r:)...$i......Y.....
/..@..0..mR............2.67.207.67.in-addr.arpa................7.ns1.digitalocean.com.
hostmaster..Y.. ..*0.....	:.....
19:47:14.995942 IP lamponubuntu2204-s-1vcpu-1gb-tor1-01.38514 > 67.207.67.3.domain: Flags [.], ack 227, win 502, options [nop,nop,TS val 3498913982 ecr 801250880], length 0
E..4.m@.@..l.c..C.C..r.5.$i.:).............
..0./..@
19:47:14.995969 IP lamponubuntu2204-s-1vcpu-1gb-tor1-01.52381 > 67.207.67.2.domain: 51759+ PTR? 2.67.207.67.in-addr.arpa. (42)
E..F~...@....c..C.C....5.2.,./...........2.67.207.67.in-addr.arpa.....
19:47:14.996138 IP 67.207.67.2.domain > lamponubuntu2204-s-1vcpu-1gb-tor1-01.38268: 52045 NXDomain 0/1/0 (109)
E....}..<...C.C..c...5.|.u...M...........2.67.207.67.in-addr.arpa..............T.7.ns1.digitalocean.com.
hostmaster..Y.. ..*0.....	:.....
19:47:14.996318 IP 67.207.67.2.domain > lamponubuntu2204-s-1vcpu-1gb-tor1-01.52381: 51759 NXDomain 0/1/0 (109)
E....~..<...C.C..c...5...u.../...........2.67.207.67.in-addr.arpa..............T.7.ns1.digitalocean.com.
hostmaster..Y.. ..*0.....	:.....
19:47:14.997253 IP lamponubuntu2204-s-1vcpu-1gb-tor1-01.39564 > 67.207.67.2.domain: 18498+ [1au] PTR? 3.67.207.67.in-addr.arpa. (53)
E..Q....@....c..C.C....5.=.7HB...........3.67.207.67.in-addr.arpa.......)........
19:47:14.997368 IP lamponubuntu2204-s-1vcpu-1gb-tor1-01.39339 > 67.207.67.2.domain: 39453+ [1au] PTR? 3.67.207.67.in-addr.arpa. (53)
E..Qp#..@....c..C.C....5.=.7.............3.67.207.67.in-addr.arpa.......)........
19:47:14.997406 IP lamponubuntu2204-s-1vcpu-1gb-tor1-01.38514 > 67.207.67.3.domain: Flags [P.], seq 93:137, ack 227, win 502, options [nop,nop,TS val 3498913983 ecr 801250880], length 44 32286+ PTR? 3.67.207.67.in-addr.arpa. (42)
E..`.n@.@..?.c..C.C..r.5.$i.:).......<.....
..0./..@.*~............3.67.207.67.in-addr.arpa.....
19:47:14.997742 IP 67.207.67.2.domain > lamponubuntu2204-s-1vcpu-1gb-tor1-01.39564: 18498 NXDomain 0/1/1 (120)
E.......<...C.C..c...5....JTHB...........3.67.207.67.in-addr.arpa................7.ns1.digitalocean.com.
hostmaster..Y.. ..*0.....	:.......)........
19:47:14.997806 IP 67.207.67.2.domain > lamponubuntu2204-s-1vcpu-1gb-tor1-01.39339: 39453 NXDomain 0/1/1 (120)
E.......<...C.C..c...5.....Y.............3.67.207.67.in-addr.arpa................7.ns1.digitalocean.com.
hostmaster..Y.. ..*0.....	:.......)........
19:47:14.997929 IP lamponubuntu2204-s-1vcpu-1gb-tor1-01.39564 > 67.207.67.2.domain: 18498+ PTR? 3.67.207.67.in-addr.arpa. (42)
E..F....@....c..C.C....5.2.,HB...........3.67.207.67.in-addr.arpa.....
19:47:14.997986 IP lamponubuntu2204-s-1vcpu-1gb-tor1-01.39339 > 67.207.67.2.domain: 39453+ PTR? 3.67.207.67.in-addr.arpa. (42)
E..Fp$..@....c..C.C....5.2.,.............3.67.207.67.in-addr.arpa.....
19:47:14.998015 IP 67.207.67.3.domain > lamponubuntu2204-s-1vcpu-1gb-tor1-01.38514: Flags [P.], seq 227:338, ack 137, win 128, options [nop,nop,TS val 801250882 ecr 3498913983], length 111 32286 NXDomain 0/1/0 (109)
E...(R@.<.(.C.C..c...5.r:)...$j............
/..B..0..m~............3.67.207.67.in-addr.arpa..............I.7.ns1.digitalocean.com.
hostmaster..Y.. ..*0.....	:.....
19:47:14.998635 IP 67.207.67.2.domain > lamponubuntu2204-s-1vcpu-1gb-tor1-01.39564: 18498 NXDomain 0/1/0 (109)
E.......<...C.C..c...5...uN.HB...........3.67.207.67.in-addr.arpa..............I.7.ns1.digitalocean.com.
hostmaster..Y.. ..*0.....	:.....
19:47:14.998755 IP 67.207.67.2.domain > lamponubuntu2204-s-1vcpu-1gb-tor1-01.39339: 39453 NXDomain 0/1/0 (109)
E.......<...C.C..c...5...u...............3.67.207.67.in-addr.arpa................7.ns1.digitalocean.com.
hostmaster..Y.. ..*0.....	:.....
19:47:15.038585 IP lamponubuntu2204-s-1vcpu-1gb-tor1-01.38514 > 67.207.67.3.domain: Flags [.], ack 338, win 502, options [nop,nop,TS val 3498914025 ecr 801250882], length 0
E..4.o@.@..j.c..C.C..r.5.$j.:).............
..0./..B
19:47:17.500732 IP 67.207.67.3.domain > lamponubuntu2204-s-1vcpu-1gb-tor1-01.38514: Flags [F.], seq 338, ack 137, win 128, options [nop,nop,TS val 801253385 ecr 3498914025], length 0
E..4(S@.<.(.C.C..c...5.r:)...$j......{.....
/.(	..0.
19:47:17.500884 IP lamponubuntu2204-s-1vcpu-1gb-tor1-01.38514 > 67.207.67.3.domain: Flags [F.], seq 137, ack 339, win 502, options [nop,nop,TS val 3498916487 ecr 801253385], length 0
E..4.p@.@..i.c..C.C..r.5.$j.:).............
..:./.(	
19:47:17.501280 IP 67.207.67.3.domain > lamponubuntu2204-s-1vcpu-1gb-tor1-01.38514: Flags [.], ack 138, win 128, options [nop,nop,TS val 801253386 ecr 3498916487], length 0
E..4(T@.<.(.C.C..c...5.r:)...$j............
/.(
..:.
19:47:17.566745 IP 79.110.62.122.45306 > lamponubuntu2204-s-1vcpu-1gb-tor1-01.sunrpc: Flags [S], seq 1475244747, win 1024, length 0
E..(........On>z.c.....oW.r.....P...:.....
19:47:18.067126 IP lamponubuntu2204-s-1vcpu-1gb-tor1-01.47209 > 67.207.67.2.domain: 55468+ [1au] PTR? 122.62.110.79.in-addr.arpa. (55)
E..S#...@.h..c..C.C..i.5.?.9.............122.62.110.79.in-addr.arpa.......)........
19:47:18.067240 IP lamponubuntu2204-s-1vcpu-1gb-tor1-01.44229 > 67.207.67.2.domain: 5004+ [1au] PTR? 122.62.110.79.in-addr.arpa. (55)
E..S....@....c..C.C....5.?.9.............122.62.110.79.in-addr.arpa.......)........
19:47:18.067285 IP lamponubuntu2204-s-1vcpu-1gb-tor1-01.38524 > 67.207.67.3.domain: Flags [S], seq 645080018, win 64240, options [mss 1460,sackOK,TS val 3498917053 ecr 0,nop,wscale 7,tfo  cookiereq,nop,nop], length 0
E..@..@.@._..c..C.C..|.5&s#....................
..<........."...
19:47:18.067642 IP 67.207.67.3.domain > lamponubuntu2204-s-1vcpu-1gb-tor1-01.38524: Flags [S.], seq 1065589575, ack 645080019, win 65160, options [mss 1460,sackOK,TS val 3989759151 ecr 3498917053,nop,wscale 9], length 0
E..<..@.<.P.C.C..c...5.|?..G&s#................
......<....	
19:47:18.067642 IP 67.207.67.2.domain > lamponubuntu2204-s-1vcpu-1gb-tor1-01.44229: 5004 NXDomain 0/1/1 (115)
E.......<...C.C..c...5...{\..............122.62.110.79.in-addr.arpa................0.pri.authdns.ripe.net..dns.De..........X../.......)........
19:47:18.067680 IP lamponubuntu2204-s-1vcpu-1gb-tor1-01.38524 > 67.207.67.3.domain: Flags [.], ack 1, win 502, options [nop,nop,TS val 3498917054 ecr 3989759151], length 0
E..4..@.@._..c..C.C..|.5&s#.?..H...........
..<.....
19:47:18.067724 IP lamponubuntu2204-s-1vcpu-1gb-tor1-01.38524 > 67.207.67.3.domain: Flags [P.], seq 1:47, ack 1, win 502, options [nop,nop,TS val 3498917054 ecr 3989759151], length 46 40587+ PTR? 122.62.110.79.in-addr.arpa. (44)
E..b..@.@._..c..C.C..|.5&s#.?..H.....>.....
..<......,.............122.62.110.79.in-addr.arpa.....
19:47:18.067805 IP lamponubuntu2204-s-1vcpu-1gb-tor1-01.44229 > 67.207.67.2.domain: 5004+ PTR? 122.62.110.79.in-addr.arpa. (44)
E..H....@....c..C.C....5.4...............122.62.110.79.in-addr.arpa.....
19:47:18.067913 IP 67.207.67.3.domain > lamponubuntu2204-s-1vcpu-1gb-tor1-01.38524: Flags [.], ack 47, win 128, options [nop,nop,TS val 3989759151 ecr 3498917054], length 0
E..4..@.<.o.C.C..c...5.|?..H&s$............
......<.
19:47:18.068090 IP 67.207.67.2.domain > lamponubuntu2204-s-1vcpu-1gb-tor1-01.44229: 5004 NXDomain 0/1/0 (104)
E.......<...C.C..c...5...p...............122.62.110.79.in-addr.arpa................0.pri.authdns.ripe.net..dns.De..........X../.....
19:47:18.068675 IP 67.207.67.2.domain > lamponubuntu2204-s-1vcpu-1gb-tor1-01.47209: 55468 NXDomain 0/1/1 (115)
E.......<...C.C..c...5.i.{~..............122.62.110.79.in-addr.arpa................0.pri.authdns.ripe.net..dns.De..........X../.......)........
19:47:18.068812 IP lamponubuntu2204-s-1vcpu-1gb-tor1-01.47209 > 67.207.67.2.domain: 55468+ PTR? 122.62.110.79.in-addr.arpa. (44)
E..H#...@.i..c..C.C..i.5.4...............122.62.110.79.in-addr.arpa.....
19:47:18.068936 IP 67.207.67.3.domain > lamponubuntu2204-s-1vcpu-1gb-tor1-01.38524: Flags [P.], seq 1:107, ack 47, win 128, options [nop,nop,TS val 3989759152 ecr 3498917054], length 106 40587 NXDomain 0/1/0 (104)
E.....@.<.o.C.C..c...5.|?..H&s$.....u".....
......<..h.............122.62.110.79.in-addr.arpa................0.pri.authdns.ripe.net..dns.De..........X../.....
19:47:18.068952 IP lamponubuntu2204-s-1vcpu-1gb-tor1-01.38524 > 67.207.67.3.domain: Flags [.], ack 107, win 502, options [nop,nop,TS val 3498917055 ecr 3989759152], length 0
E..4..@.@._..c..C.C..|.5&s$.?..............
..<.....
19:47:18.069222 IP 67.207.67.2.domain > lamponubuntu2204-s-1vcpu-1gb-tor1-01.47209: 55468 NXDomain 0/1/0 (104)
E.......<...C.C..c...5.i.p...............122.62.110.79.in-addr.arpa................0.pri.authdns.ripe.net..dns.De..........X../.....

