19:50:54.499340 IP lamponubuntu2204-s-1vcpu-1gb-tor1-01.ssh > 198.211.111.194.56162: Flags [P.], seq 1946421785:1946421913, ack 1079914601, win 501, options [nop,nop,TS val 3599793044 ecr 3971535632], length 128
19:50:54.499405 IP lamponubuntu2204-s-1vcpu-1gb-tor1-01.ssh > 198.211.111.194.56162: Flags [P.], seq 128:192, ack 1, win 501, options [nop,nop,TS val 3599793044 ecr 3971535632], length 64
19:50:54.499444 IP lamponubuntu2204-s-1vcpu-1gb-tor1-01.ssh > 198.211.111.194.56162: Flags [P.], seq 192:272, ack 1, win 501, options [nop,nop,TS val 3599793044 ecr 3971535632], length 80
19:50:54.499480 IP lamponubuntu2204-s-1vcpu-1gb-tor1-01.ssh > 198.211.111.194.56162: Flags [P.], seq 272:352, ack 1, win 501, options [nop,nop,TS val 3599793044 ecr 3971535632], length 80
19:50:54.499516 IP lamponubuntu2204-s-1vcpu-1gb-tor1-01.ssh > 198.211.111.194.56162: Flags [P.], seq 352:432, ack 1, win 501, options [nop,nop,TS val 3599793045 ecr 3971535632], length 80
19:50:54.499549 IP lamponubuntu2204-s-1vcpu-1gb-tor1-01.ssh > 198.211.111.194.56162: Flags [P.], seq 432:496, ack 1, win 501, options [nop,nop,TS val 3599793045 ecr 3971535632], length 64
19:50:54.508801 IP 198.211.111.194.56162 > lamponubuntu2204-s-1vcpu-1gb-tor1-01.ssh: Flags [.], ack 0, win 501, options [nop,nop,TS val 3971535650 ecr 3599793040], length 0
19:50:54.513550 IP 198.211.111.194.56162 > lamponubuntu2204-s-1vcpu-1gb-tor1-01.ssh: Flags [.], ack 128, win 501, options [nop,nop,TS val 3971535655 ecr 3599793044], length 0
19:50:54.513551 IP 198.211.111.194.56162 > lamponubuntu2204-s-1vcpu-1gb-tor1-01.ssh: Flags [.], ack 192, win 501, options [nop,nop,TS val 3971535655 ecr 3599793044], length 0
19:50:54.513551 IP 198.211.111.194.56162 > lamponubuntu2204-s-1vcpu-1gb-tor1-01.ssh: Flags [.], ack 272, win 501, options [nop,nop,TS val 3971535655 ecr 3599793044], length 0
19:50:54.513551 IP 198.211.111.194.56162 > lamponubuntu2204-s-1vcpu-1gb-tor1-01.ssh: Flags [.], ack 352, win 501, options [nop,nop,TS val 3971535655 ecr 3599793044], length 0
19:50:54.513627 IP 198.211.111.194.56162 > lamponubuntu2204-s-1vcpu-1gb-tor1-01.ssh: Flags [.], ack 432, win 501, options [nop,nop,TS val 3971535655 ecr 3599793045], length 0
19:50:54.513627 IP 198.211.111.194.56162 > lamponubuntu2204-s-1vcpu-1gb-tor1-01.ssh: Flags [.], ack 496, win 501, options [nop,nop,TS val 3971535655 ecr 3599793045], length 0

