19:47:01.906349 IP lamponubuntu2204-s-1vcpu-1gb-tor1-01.ssh > 198.211.111.194.56162: Flags [P.], seq 1946361721:1946361849, ack 1079892265, win 502, options [nop,nop,TS val 3599560451 ecr 3971303039], length 128
19:47:01.906433 IP lamponubuntu2204-s-1vcpu-1gb-tor1-01.ssh > 198.211.111.194.56162: Flags [P.], seq 128:192, ack 1, win 502, options [nop,nop,TS val 3599560451 ecr 3971303039], length 64
19:47:01.906488 IP lamponubuntu2204-s-1vcpu-1gb-tor1-01.ssh > 198.211.111.194.56162: Flags [P.], seq 192:272, ack 1, win 502, options [nop,nop,TS val 3599560451 ecr 3971303039], length 80
19:47:01.906590 IP lamponubuntu2204-s-1vcpu-1gb-tor1-01.ssh > 198.211.111.194.56162: Flags [P.], seq 272:352, ack 1, win 502, options [nop,nop,TS val 3599560452 ecr 3971303039], length 80
19:47:01.906638 IP lamponubuntu2204-s-1vcpu-1gb-tor1-01.ssh > 198.211.111.194.56162: Flags [P.], seq 352:432, ack 1, win 502, options [nop,nop,TS val 3599560452 ecr 3971303039], length 80
