20:55:41.491591 IP lamponubuntu2204-s-1vcpu-1gb-tor1-01.ssh > 198.96.85.163.40012: Flags [P.], seq 2384861802:2384861910, ack 1830340594, win 501, options [nop,nop,TS val 303630858 ecr 2589437150], length 108
20:55:41.491682 IP lamponubuntu2204-s-1vcpu-1gb-tor1-01.ssh > 198.96.85.163.40012: Flags [P.], seq 108:264, ack 1, win 501, options [nop,nop,TS val 303630858 ecr 2589437150], length 156
20:55:41.491803 IP lamponubuntu2204-s-1vcpu-1gb-tor1-01.ssh > 198.96.85.163.40012: Flags [P.], seq 264:332, ack 1, win 501, options [nop,nop,TS val 303630858 ecr 2589437150], length 68
20:55:41.491855 IP lamponubuntu2204-s-1vcpu-1gb-tor1-01.ssh > 198.96.85.163.40012: Flags [P.], seq 332:368, ack 1, win 501, options [nop,nop,TS val 303630858 ecr 2589437150], length 36
20:55:41.494271 IP 198.96.85.163.40012 > lamponubuntu2204-s-1vcpu-1gb-tor1-01.ssh: Flags [.], ack 108, win 176, options [nop,nop,TS val 2589437157 ecr 303630858], length 0
20:55:41.494271 IP 198.96.85.163.40012 > lamponubuntu2204-s-1vcpu-1gb-tor1-01.ssh: Flags [.], ack 264, win 175, options [nop,nop,TS val 2589437157 ecr 303630858], length 0
20:55:41.494271 IP 198.96.85.163.40012 > lamponubuntu2204-s-1vcpu-1gb-tor1-01.ssh: Flags [.], ack 332, win 175, options [nop,nop,TS val 2589437157 ecr 303630858], length 0
20:55:41.494441 IP 198.96.85.163.40012 > lamponubuntu2204-s-1vcpu-1gb-tor1-01.ssh: Flags [.], ack 368, win 175, options [nop,nop,TS val 2589437157 ecr 303630858], length 0
20:55:42.287161 IP 64.23.183.39.44528 > lamponubuntu2204-s-1vcpu-1gb-tor1-01.ssh: Flags [S], seq 2235488449, win 64240, options [mss 1460,sackOK,TS val 1069261040 ecr 0,nop,wscale 7], length 0
20:55:42.287231 IP lamponubuntu2204-s-1vcpu-1gb-tor1-01.ssh > 64.23.183.39.44528: Flags [S.], seq 1127106370, ack 2235488450, win 65160, options [mss 1460,sackOK,TS val 4243162218 ecr 1069261040,nop,wscale 7], length 0
20:55:42.375399 IP 64.23.183.39.44528 > lamponubuntu2204-s-1vcpu-1gb-tor1-01.ssh: Flags [.], ack 1, win 502, options [nop,nop,TS val 1069261129 ecr 4243162218], length 0
20:55:42.375400 IP 64.23.183.39.44528 > lamponubuntu2204-s-1vcpu-1gb-tor1-01.ssh: Flags [P.], seq 1:13, ack 1, win 502, options [nop,nop,TS val 1069261129 ecr 4243162218], length 12: SSH: SSH-2.0-Go
20:55:42.375520 IP lamponubuntu2204-s-1vcpu-1gb-tor1-01.ssh > 64.23.183.39.44528: Flags [.], ack 13, win 509, options [nop,nop,TS val 4243162306 ecr 1069261129], length 0
20:55:42.394221 IP lamponubuntu2204-s-1vcpu-1gb-tor1-01.ssh > 64.23.183.39.44528: Flags [P.], seq 1:42, ack 13, win 509, options [nop,nop,TS val 4243162325 ecr 1069261129], length 41: SSH: SSH-2.0-OpenSSH_8.9p1 Ubuntu-3ubuntu0.6
20:55:42.481679 IP 64.23.183.39.44528 > lamponubuntu2204-s-1vcpu-1gb-tor1-01.ssh: Flags [.], ack 42, win 502, options [nop,nop,TS val 1069261235 ecr 4243162325], length 0
20:55:42.481679 IP 64.23.183.39.44528 > lamponubuntu2204-s-1vcpu-1gb-tor1-01.ssh: Flags [P.], seq 13:973, ack 42, win 502, options [nop,nop,TS val 1069261235 ecr 4243162325], length 960
20:55:42.481733 IP lamponubuntu2204-s-1vcpu-1gb-tor1-01.ssh > 64.23.183.39.44528: Flags [P.], seq 42:1154, ack 13, win 509, options [nop,nop,TS val 4243162412 ecr 1069261235], length 1112
20:55:42.518128 IP lamponubuntu2204-s-1vcpu-1gb-tor1-01.55178 > 67.207.67.2.domain: 47702+ PTR? 163.85.96.198.in-addr.arpa. (44)
20:55:42.518277 IP lamponubuntu2204-s-1vcpu-1gb-tor1-01.33586 > 67.207.67.2.domain: 29455+ PTR? 163.85.96.198.in-addr.arpa. (44)
20:55:42.518354 IP lamponubuntu2204-s-1vcpu-1gb-tor1-01.58324 > 67.207.67.2.domain: Flags [S], seq 227752739, win 64240, options [mss 1460,sackOK,TS val 3582641368 ecr 0,nop,wscale 7,tfo  cookiereq,nop,nop], length 0
20:55:42.519121 IP 67.207.67.2.domain > lamponubuntu2204-s-1vcpu-1gb-tor1-01.58324: Flags [S.], seq 2921313761, ack 227752740, win 65160, options [mss 1460,sackOK,TS val 277125322 ecr 3582641368,nop,wscale 9], length 0
20:55:42.519167 IP lamponubuntu2204-s-1vcpu-1gb-tor1-01.58324 > 67.207.67.2.domain: Flags [.], ack 1, win 502, options [nop,nop,TS val 3582641369 ecr 277125322], length 0
20:55:42.519209 IP lamponubuntu2204-s-1vcpu-1gb-tor1-01.58324 > 67.207.67.2.domain: Flags [P.], seq 1:47, ack 1, win 502, options [nop,nop,TS val 3582641369 ecr 277125322], length 46 24916+ PTR? 163.85.96.198.in-addr.arpa. (44)
20:55:42.519447 IP 67.207.67.2.domain > lamponubuntu2204-s-1vcpu-1gb-tor1-01.33586: 29455 NXDomain 0/1/0 (109)
20:55:42.519448 IP 67.207.67.2.domain > lamponubuntu2204-s-1vcpu-1gb-tor1-01.55178: 47702 NXDomain 0/1/0 (109)
20:55:42.519605 IP 67.207.67.2.domain > lamponubuntu2204-s-1vcpu-1gb-tor1-01.58324: Flags [.], ack 47, win 128, options [nop,nop,TS val 277125322 ecr 3582641369], length 0
20:55:42.522473 IP 67.207.67.2.domain > lamponubuntu2204-s-1vcpu-1gb-tor1-01.58324: Flags [P.], seq 1:112, ack 47, win 128, options [nop,nop,TS val 277125325 ecr 3582641369], length 111 24916 NXDomain 0/1/0 (109)
20:55:42.522508 IP lamponubuntu2204-s-1vcpu-1gb-tor1-01.58324 > 67.207.67.2.domain: Flags [.], ack 112, win 502, options [nop,nop,TS val 3582641372 ecr 277125325], length 0
20:55:42.523189 IP lamponubuntu2204-s-1vcpu-1gb-tor1-01.52870 > 67.207.67.2.domain: 7367+ PTR? 180.191.99.167.in-addr.arpa. (45)
20:55:42.523604 IP 67.207.67.2.domain > lamponubuntu2204-s-1vcpu-1gb-tor1-01.52870: 7367 NXDomain 0/1/0 (112)
20:55:42.524502 IP lamponubuntu2204-s-1vcpu-1gb-tor1-01.48940 > 67.207.67.2.domain: 14961+ PTR? 39.183.23.64.in-addr.arpa. (43)
20:55:42.524618 IP lamponubuntu2204-s-1vcpu-1gb-tor1-01.59745 > 67.207.67.2.domain: 21867+ PTR? 39.183.23.64.in-addr.arpa. (43)
20:55:42.524653 IP lamponubuntu2204-s-1vcpu-1gb-tor1-01.58324 > 67.207.67.2.domain: Flags [P.], seq 47:92, ack 112, win 502, options [nop,nop,TS val 3582641374 ecr 277125325], length 45 31958+ PTR? 39.183.23.64.in-addr.arpa. (43)
20:55:42.524883 IP 67.207.67.2.domain > lamponubuntu2204-s-1vcpu-1gb-tor1-01.48940: 14961 NXDomain 0/1/0 (110)
20:55:42.524951 IP 67.207.67.2.domain > lamponubuntu2204-s-1vcpu-1gb-tor1-01.59745: 21867 NXDomain 0/1/0 (110)
20:55:42.525186 IP lamponubuntu2204-s-1vcpu-1gb-tor1-01.ssh > 64.23.183.39.44528: Flags [.], ack 973, win 502, options [nop,nop,TS val 4243162456 ecr 1069261235], length 0
20:55:42.525830 IP 67.207.67.2.domain > lamponubuntu2204-s-1vcpu-1gb-tor1-01.58324: Flags [P.], seq 112:224, ack 92, win 128, options [nop,nop,TS val 277125329 ecr 3582641374], length 112 31958 NXDomain 0/1/0 (110)
20:55:42.569219 IP lamponubuntu2204-s-1vcpu-1gb-tor1-01.58324 > 67.207.67.2.domain: Flags [.], ack 224, win 502, options [nop,nop,TS val 3582641419 ecr 277125329], length 0
20:55:42.569251 IP 64.23.183.39.44528 > lamponubuntu2204-s-1vcpu-1gb-tor1-01.ssh: Flags [P.], seq 973:1021, ack 1154, win 501, options [nop,nop,TS val 1069261323 ecr 4243162412], length 48
20:55:42.569292 IP lamponubuntu2204-s-1vcpu-1gb-tor1-01.ssh > 64.23.183.39.44528: Flags [.], ack 1021, win 502, options [nop,nop,TS val 4243162500 ecr 1069261323], length 0
20:55:42.578805 IP lamponubuntu2204-s-1vcpu-1gb-tor1-01.ssh > 64.23.183.39.44528: Flags [P.], seq 1154:1758, ack 1021, win 502, options [nop,nop,TS val 4243162509 ecr 1069261323], length 604
20:55:42.666489 IP 64.23.183.39.44528 > lamponubuntu2204-s-1vcpu-1gb-tor1-01.ssh: Flags [P.], seq 1021:1037, ack 1758, win 501, options [nop,nop,TS val 1069261420 ecr 4243162509], length 16
20:55:42.666490 IP 64.23.183.39.44528 > lamponubuntu2204-s-1vcpu-1gb-tor1-01.ssh: Flags [P.], seq 1037:1089, ack 1758, win 501, options [nop,nop,TS val 1069261420 ecr 4243162509], length 52
20:55:42.666614 IP lamponubuntu2204-s-1vcpu-1gb-tor1-01.ssh > 64.23.183.39.44528: Flags [.], ack 1089, win 502, options [nop,nop,TS val 4243162597 ecr 1069261420], length 0
20:55:42.666732 IP lamponubuntu2204-s-1vcpu-1gb-tor1-01.ssh > 64.23.183.39.44528: Flags [P.], seq 1758:1810, ack 1089, win 502, options [nop,nop,TS val 4243162597 ecr 1069261420], length 52
20:55:42.754316 IP 64.23.183.39.44528 > lamponubuntu2204-s-1vcpu-1gb-tor1-01.ssh: Flags [P.], seq 1089:1157, ack 1810, win 501, options [nop,nop,TS val 1069261508 ecr 4243162597], length 68
20:55:42.761266 IP lamponubuntu2204-s-1vcpu-1gb-tor1-01.ssh > 64.23.183.39.44528: Flags [P.], seq 1810:1862, ack 1157, win 502, options [nop,nop,TS val 4243162692 ecr 1069261508], length 52
20:55:42.848639 IP 64.23.183.39.44528 > lamponubuntu2204-s-1vcpu-1gb-tor1-01.ssh: Flags [F.], seq 1157, ack 1862, win 501, options [nop,nop,TS val 1069261602 ecr 4243162692], length 0
20:55:42.850662 IP lamponubuntu2204-s-1vcpu-1gb-tor1-01.ssh > 64.23.183.39.44528: Flags [F.], seq 1862, ack 1158, win 502, options [nop,nop,TS val 4243162781 ecr 1069261602], length 0
20:55:42.938073 IP 64.23.183.39.44528 > lamponubuntu2204-s-1vcpu-1gb-tor1-01.ssh: Flags [.], ack 1863, win 501, options [nop,nop,TS val 1069261692 ecr 4243162781], length 0
20:55:43.541970 IP lamponubuntu2204-s-1vcpu-1gb-tor1-01.55082 > 67.207.67.2.domain: 56371+ PTR? 2.67.207.67.in-addr.arpa. (42)
20:55:43.542115 IP lamponubuntu2204-s-1vcpu-1gb-tor1-01.49213 > 67.207.67.2.domain: 34611+ PTR? 2.67.207.67.in-addr.arpa. (42)
20:55:43.542158 IP lamponubuntu2204-s-1vcpu-1gb-tor1-01.58324 > 67.207.67.2.domain: Flags [P.], seq 92:136, ack 224, win 502, options [nop,nop,TS val 3582642392 ecr 277125329], length 44 4326+ PTR? 2.67.207.67.in-addr.arpa. (42)
20:55:43.542603 IP 67.207.67.2.domain > lamponubuntu2204-s-1vcpu-1gb-tor1-01.55082: 56371 NXDomain 0/1/0 (109)
20:55:43.542603 IP 67.207.67.2.domain > lamponubuntu2204-s-1vcpu-1gb-tor1-01.49213: 34611 NXDomain 0/1/0 (109)
20:55:43.545227 IP 67.207.67.2.domain > lamponubuntu2204-s-1vcpu-1gb-tor1-01.58324: Flags [P.], seq 224:335, ack 136, win 128, options [nop,nop,TS val 277126346 ecr 3582642392], length 111 4326 NXDomain 0/1/0 (109)
20:55:43.545272 IP lamponubuntu2204-s-1vcpu-1gb-tor1-01.58324 > 67.207.67.2.domain: Flags [.], ack 335, win 502, options [nop,nop,TS val 3582642395 ecr 277126346], length 0
20:55:45.462857 IP 178.128.102.141.43610 > lamponubuntu2204-s-1vcpu-1gb-tor1-01.ssh: Flags [S], seq 1598663762, win 64240, options [mss 1460,sackOK,TS val 4121999951 ecr 0,nop,wscale 7], length 0
20:55:45.462930 IP lamponubuntu2204-s-1vcpu-1gb-tor1-01.ssh > 178.128.102.141.43610: Flags [S.], seq 3959283372, ack 1598663763, win 65160, options [mss 1460,sackOK,TS val 3812270418 ecr 4121999951,nop,wscale 7], length 0
20:55:45.589819 IP lamponubuntu2204-s-1vcpu-1gb-tor1-01.54185 > 67.207.67.2.domain: 42626+ PTR? 141.102.128.178.in-addr.arpa. (46)
20:55:45.589937 IP lamponubuntu2204-s-1vcpu-1gb-tor1-01.36922 > 67.207.67.2.domain: 35054+ PTR? 141.102.128.178.in-addr.arpa. (46)
20:55:45.589981 IP lamponubuntu2204-s-1vcpu-1gb-tor1-01.58324 > 67.207.67.2.domain: Flags [P.], seq 136:184, ack 335, win 502, options [nop,nop,TS val 3582644439 ecr 277126346], length 48 4846+ PTR? 141.102.128.178.in-addr.arpa. (46)
20:55:45.590242 IP 67.207.67.2.domain > lamponubuntu2204-s-1vcpu-1gb-tor1-01.54185: 42626 NXDomain 0/1/0 (113)
20:55:45.590294 IP 67.207.67.2.domain > lamponubuntu2204-s-1vcpu-1gb-tor1-01.36922: 35054 NXDomain 0/1/0 (113)
20:55:45.590972 IP 67.207.67.2.domain > lamponubuntu2204-s-1vcpu-1gb-tor1-01.58324: Flags [P.], seq 335:450, ack 184, win 128, options [nop,nop,TS val 277128394 ecr 3582644439], length 115 4846 NXDomain 0/1/0 (113)
20:55:45.590998 IP lamponubuntu2204-s-1vcpu-1gb-tor1-01.58324 > 67.207.67.2.domain: Flags [.], ack 450, win 502, options [nop,nop,TS val 3582644440 ecr 277128394], length 0
20:55:45.711099 IP 178.128.102.141.43610 > lamponubuntu2204-s-1vcpu-1gb-tor1-01.ssh: Flags [.], ack 1, win 502, options [nop,nop,TS val 4122000199 ecr 3812270418], length 0
20:55:45.711193 IP 178.128.102.141.43610 > lamponubuntu2204-s-1vcpu-1gb-tor1-01.ssh: Flags [P.], seq 1:23, ack 1, win 502, options [nop,nop,TS val 4122000199 ecr 3812270418], length 22: SSH: SSH-2.0-libssh_0.9.6
20:55:45.711217 IP lamponubuntu2204-s-1vcpu-1gb-tor1-01.ssh > 178.128.102.141.43610: Flags [.], ack 23, win 509, options [nop,nop,TS val 3812270667 ecr 4122000199], length 0
20:55:45.727076 IP lamponubuntu2204-s-1vcpu-1gb-tor1-01.ssh > 178.128.102.141.43610: Flags [P.], seq 1:42, ack 23, win 509, options [nop,nop,TS val 3812270682 ecr 4122000199], length 41: SSH: SSH-2.0-OpenSSH_8.9p1 Ubuntu-3ubuntu0.6
20:55:45.974351 IP 178.128.102.141.43610 > lamponubuntu2204-s-1vcpu-1gb-tor1-01.ssh: Flags [.], ack 42, win 502, options [nop,nop,TS val 4122000463 ecr 3812270682], length 0
20:55:45.974351 IP 178.128.102.141.43610 > lamponubuntu2204-s-1vcpu-1gb-tor1-01.ssh: Flags [P.], seq 23:999, ack 42, win 502, options [nop,nop,TS val 4122000463 ecr 3812270682], length 976
20:55:45.974406 IP lamponubuntu2204-s-1vcpu-1gb-tor1-01.ssh > 178.128.102.141.43610: Flags [P.], seq 42:1154, ack 23, win 509, options [nop,nop,TS val 3812270930 ecr 4122000463], length 1112
20:55:46.017224 IP lamponubuntu2204-s-1vcpu-1gb-tor1-01.ssh > 178.128.102.141.43610: Flags [.], ack 999, win 502, options [nop,nop,TS val 3812270973 ecr 4122000463], length 0
20:55:46.263841 IP 178.128.102.141.43610 > lamponubuntu2204-s-1vcpu-1gb-tor1-01.ssh: Flags [.], ack 1154, win 501, options [nop,nop,TS val 4122000752 ecr 3812270930], length 0
20:55:46.264602 IP 178.128.102.141.43610 > lamponubuntu2204-s-1vcpu-1gb-tor1-01.ssh: Flags [P.], seq 999:1047, ack 1154, win 501, options [nop,nop,TS val 4122000753 ecr 3812270973], length 48
20:55:46.264638 IP lamponubuntu2204-s-1vcpu-1gb-tor1-01.ssh > 178.128.102.141.43610: Flags [.], ack 1047, win 502, options [nop,nop,TS val 3812271220 ecr 4122000753], length 0
20:55:46.272294 IP lamponubuntu2204-s-1vcpu-1gb-tor1-01.ssh > 178.128.102.141.43610: Flags [P.], seq 1154:1686, ack 1047, win 502, options [nop,nop,TS val 3812271228 ecr 4122000753], length 532
20:55:46.519679 IP 178.128.102.141.43610 > lamponubuntu2204-s-1vcpu-1gb-tor1-01.ssh: Flags [.], ack 1686, win 501, options [nop,nop,TS val 4122001008 ecr 3812271228], length 0
20:55:46.519679 IP 178.128.102.141.43610 > lamponubuntu2204-s-1vcpu-1gb-tor1-01.ssh: Flags [P.], seq 1047:1063, ack 1686, win 501, options [nop,nop,TS val 4122001008 ecr 3812271228], length 16
20:55:46.561224 IP lamponubuntu2204-s-1vcpu-1gb-tor1-01.ssh > 178.128.102.141.43610: Flags [.], ack 1063, win 502, options [nop,nop,TS val 3812271517 ecr 4122001008], length 0
20:55:46.728469 IP 198.96.85.163 > lamponubuntu2204-s-1vcpu-1gb-tor1-01: ICMP echo request, id 3, seq 1, length 1480
20:55:46.728542 IP 198.96.85.163 > lamponubuntu2204-s-1vcpu-1gb-tor1-01: icmp
20:55:46.728644 IP 198.96.85.163 > lamponubuntu2204-s-1vcpu-1gb-tor1-01: icmp
20:55:46.728712 IP lamponubuntu2204-s-1vcpu-1gb-tor1-01 > 198.96.85.163: ICMP echo reply, id 3, seq 1, length 1480
20:55:46.728729 IP lamponubuntu2204-s-1vcpu-1gb-tor1-01 > 198.96.85.163: icmp
20:55:46.728732 IP lamponubuntu2204-s-1vcpu-1gb-tor1-01 > 198.96.85.163: icmp
20:55:46.808567 IP 178.128.102.141.43610 > lamponubuntu2204-s-1vcpu-1gb-tor1-01.ssh: Flags [P.], seq 1063:1115, ack 1686, win 501, options [nop,nop,TS val 4122001297 ecr 3812271517], length 52
20:55:46.808619 IP lamponubuntu2204-s-1vcpu-1gb-tor1-01.ssh > 178.128.102.141.43610: Flags [.], ack 1115, win 502, options [nop,nop,TS val 3812271764 ecr 4122001297], length 0
20:55:46.808777 IP lamponubuntu2204-s-1vcpu-1gb-tor1-01.ssh > 178.128.102.141.43610: Flags [P.], seq 1686:1738, ack 1115, win 502, options [nop,nop,TS val 3812271764 ecr 4122001297], length 52
20:55:47.056173 IP 178.128.102.141.43610 > lamponubuntu2204-s-1vcpu-1gb-tor1-01.ssh: Flags [P.], seq 1115:1199, ack 1738, win 501, options [nop,nop,TS val 4122001544 ecr 3812271764], length 84
20:55:47.061794 IP lamponubuntu2204-s-1vcpu-1gb-tor1-01.ssh > 178.128.102.141.43610: Flags [P.], seq 1738:1790, ack 1199, win 502, options [nop,nop,TS val 3812272017 ecr 4122001544], length 52
20:55:47.309326 IP 178.128.102.141.43610 > lamponubuntu2204-s-1vcpu-1gb-tor1-01.ssh: Flags [P.], seq 1199:1251, ack 1790, win 501, options [nop,nop,TS val 4122001797 ecr 3812272017], length 52
20:55:47.309326 IP 178.128.102.141.43610 > lamponubuntu2204-s-1vcpu-1gb-tor1-01.ssh: Flags [F.], seq 1251, ack 1790, win 501, options [nop,nop,TS val 4122001797 ecr 3812272017], length 0
20:55:47.312238 IP lamponubuntu2204-s-1vcpu-1gb-tor1-01.ssh > 178.128.102.141.43610: Flags [F.], seq 1790, ack 1252, win 502, options [nop,nop,TS val 3812272268 ecr 4122001797], length 0
20:55:47.559473 IP 178.128.102.141.43610 > lamponubuntu2204-s-1vcpu-1gb-tor1-01.ssh: Flags [.], ack 1791, win 501, options [nop,nop,TS val 4122002048 ecr 3812272268], length 0
20:55:47.730224 IP 198.96.85.163 > lamponubuntu2204-s-1vcpu-1gb-tor1-01: ICMP echo request, id 3, seq 2, length 1480
20:55:47.730224 IP 198.96.85.163 > lamponubuntu2204-s-1vcpu-1gb-tor1-01: icmp
20:55:47.730224 IP 198.96.85.163 > lamponubuntu2204-s-1vcpu-1gb-tor1-01: icmp
20:55:47.730283 IP lamponubuntu2204-s-1vcpu-1gb-tor1-01 > 198.96.85.163: ICMP echo reply, id 3, seq 2, length 1480
20:55:47.730295 IP lamponubuntu2204-s-1vcpu-1gb-tor1-01 > 198.96.85.163: icmp
20:55:47.730297 IP lamponubuntu2204-s-1vcpu-1gb-tor1-01 > 198.96.85.163: icmp
20:55:48.028629 IP 67.207.67.2.domain > lamponubuntu2204-s-1vcpu-1gb-tor1-01.58324: Flags [F.], seq 450, ack 184, win 128, options [nop,nop,TS val 277130831 ecr 3582644440], length 0
20:55:48.028780 IP lamponubuntu2204-s-1vcpu-1gb-tor1-01.58324 > 67.207.67.2.domain: Flags [F.], seq 184, ack 451, win 502, options [nop,nop,TS val 3582646878 ecr 277130831], length 0
20:55:48.029407 IP 67.207.67.2.domain > lamponubuntu2204-s-1vcpu-1gb-tor1-01.58324: Flags [.], ack 185, win 128, options [nop,nop,TS val 277130832 ecr 3582646878], length 0
20:55:48.732521 IP 198.96.85.163 > lamponubuntu2204-s-1vcpu-1gb-tor1-01: ICMP echo request, id 3, seq 3, length 1480
20:55:48.732521 IP 198.96.85.163 > lamponubuntu2204-s-1vcpu-1gb-tor1-01: icmp
20:55:48.732521 IP 198.96.85.163 > lamponubuntu2204-s-1vcpu-1gb-tor1-01: icmp
20:55:48.732722 IP lamponubuntu2204-s-1vcpu-1gb-tor1-01 > 198.96.85.163: ICMP echo reply, id 3, seq 3, length 1480
20:55:48.732736 IP lamponubuntu2204-s-1vcpu-1gb-tor1-01 > 198.96.85.163: icmp
20:55:48.732737 IP lamponubuntu2204-s-1vcpu-1gb-tor1-01 > 198.96.85.163: icmp
20:55:49.733030 IP 198.96.85.163 > lamponubuntu2204-s-1vcpu-1gb-tor1-01: ICMP echo request, id 3, seq 4, length 1480
20:55:49.733031 IP 198.96.85.163 > lamponubuntu2204-s-1vcpu-1gb-tor1-01: icmp
20:55:49.733031 IP 198.96.85.163 > lamponubuntu2204-s-1vcpu-1gb-tor1-01: icmp
20:55:49.733100 IP lamponubuntu2204-s-1vcpu-1gb-tor1-01 > 198.96.85.163: ICMP echo reply, id 3, seq 4, length 1480
20:55:49.733117 IP lamponubuntu2204-s-1vcpu-1gb-tor1-01 > 198.96.85.163: icmp
20:55:49.733118 IP lamponubuntu2204-s-1vcpu-1gb-tor1-01 > 198.96.85.163: icmp
20:55:50.735098 IP 198.96.85.163 > lamponubuntu2204-s-1vcpu-1gb-tor1-01: ICMP echo request, id 3, seq 5, length 1480
20:55:50.735098 IP 198.96.85.163 > lamponubuntu2204-s-1vcpu-1gb-tor1-01: icmp
20:55:50.735098 IP 198.96.85.163 > lamponubuntu2204-s-1vcpu-1gb-tor1-01: icmp
20:55:50.735165 IP lamponubuntu2204-s-1vcpu-1gb-tor1-01 > 198.96.85.163: ICMP echo reply, id 3, seq 5, length 1480
20:55:50.735180 IP lamponubuntu2204-s-1vcpu-1gb-tor1-01 > 198.96.85.163: icmp
20:55:50.735182 IP lamponubuntu2204-s-1vcpu-1gb-tor1-01 > 198.96.85.163: icmp
20:55:51.734067 IP 198.96.85.163 > lamponubuntu2204-s-1vcpu-1gb-tor1-01: ICMP echo request, id 3, seq 6, length 1480
20:55:51.734067 IP 198.96.85.163 > lamponubuntu2204-s-1vcpu-1gb-tor1-01: icmp
20:55:51.734067 IP 198.96.85.163 > lamponubuntu2204-s-1vcpu-1gb-tor1-01: icmp
20:55:51.734140 IP lamponubuntu2204-s-1vcpu-1gb-tor1-01 > 198.96.85.163: ICMP echo reply, id 3, seq 6, length 1480
20:55:51.734157 IP lamponubuntu2204-s-1vcpu-1gb-tor1-01 > 198.96.85.163: icmp
20:55:51.734162 IP lamponubuntu2204-s-1vcpu-1gb-tor1-01 > 198.96.85.163: icmp
20:55:52.735701 IP 198.96.85.163 > lamponubuntu2204-s-1vcpu-1gb-tor1-01: ICMP echo request, id 3, seq 7, length 1480
20:55:52.735701 IP 198.96.85.163 > lamponubuntu2204-s-1vcpu-1gb-tor1-01: icmp
20:55:52.735702 IP 198.96.85.163 > lamponubuntu2204-s-1vcpu-1gb-tor1-01: icmp
20:55:52.735779 IP lamponubuntu2204-s-1vcpu-1gb-tor1-01 > 198.96.85.163: ICMP echo reply, id 3, seq 7, length 1480
20:55:52.735796 IP lamponubuntu2204-s-1vcpu-1gb-tor1-01 > 198.96.85.163: icmp
20:55:52.735799 IP lamponubuntu2204-s-1vcpu-1gb-tor1-01 > 198.96.85.163: icmp
20:55:53.738657 IP 198.96.85.163 > lamponubuntu2204-s-1vcpu-1gb-tor1-01: ICMP echo request, id 3, seq 8, length 1480
20:55:53.738657 IP 198.96.85.163 > lamponubuntu2204-s-1vcpu-1gb-tor1-01: icmp
20:55:53.738657 IP 198.96.85.163 > lamponubuntu2204-s-1vcpu-1gb-tor1-01: icmp
20:55:53.738731 IP lamponubuntu2204-s-1vcpu-1gb-tor1-01 > 198.96.85.163: ICMP echo reply, id 3, seq 8, length 1480
20:55:53.738748 IP lamponubuntu2204-s-1vcpu-1gb-tor1-01 > 198.96.85.163: icmp
20:55:53.738749 IP lamponubuntu2204-s-1vcpu-1gb-tor1-01 > 198.96.85.163: icmp
20:55:54.740608 IP 198.96.85.163 > lamponubuntu2204-s-1vcpu-1gb-tor1-01: ICMP echo request, id 3, seq 9, length 1480
20:55:54.740609 IP 198.96.85.163 > lamponubuntu2204-s-1vcpu-1gb-tor1-01: icmp
20:55:54.740609 IP 198.96.85.163 > lamponubuntu2204-s-1vcpu-1gb-tor1-01: icmp
20:55:54.740687 IP lamponubuntu2204-s-1vcpu-1gb-tor1-01 > 198.96.85.163: ICMP echo reply, id 3, seq 9, length 1480
20:55:54.740704 IP lamponubuntu2204-s-1vcpu-1gb-tor1-01 > 198.96.85.163: icmp
20:55:54.740707 IP lamponubuntu2204-s-1vcpu-1gb-tor1-01 > 198.96.85.163: icmp
20:55:55.741782 IP 198.96.85.163 > lamponubuntu2204-s-1vcpu-1gb-tor1-01: ICMP echo request, id 3, seq 10, length 1480
20:55:55.741783 IP 198.96.85.163 > lamponubuntu2204-s-1vcpu-1gb-tor1-01: icmp
20:55:55.741783 IP 198.96.85.163 > lamponubuntu2204-s-1vcpu-1gb-tor1-01: icmp
20:55:55.741857 IP lamponubuntu2204-s-1vcpu-1gb-tor1-01 > 198.96.85.163: ICMP echo reply, id 3, seq 10, length 1480
20:55:55.741873 IP lamponubuntu2204-s-1vcpu-1gb-tor1-01 > 198.96.85.163: icmp
20:55:55.741875 IP lamponubuntu2204-s-1vcpu-1gb-tor1-01 > 198.96.85.163: icmp
20:55:56.719693 IP 94.156.66.64.46104 > lamponubuntu2204-s-1vcpu-1gb-tor1-01.8728: Flags [S], seq 3328436521, win 65535, length 0
20:55:56.743771 IP 198.96.85.163 > lamponubuntu2204-s-1vcpu-1gb-tor1-01: ICMP echo request, id 3, seq 11, length 1480
20:55:56.743771 IP 198.96.85.163 > lamponubuntu2204-s-1vcpu-1gb-tor1-01: icmp
20:55:56.743771 IP 198.96.85.163 > lamponubuntu2204-s-1vcpu-1gb-tor1-01: icmp
20:55:56.743832 IP lamponubuntu2204-s-1vcpu-1gb-tor1-01 > 198.96.85.163: ICMP echo reply, id 3, seq 11, length 1480
20:55:56.743850 IP lamponubuntu2204-s-1vcpu-1gb-tor1-01 > 198.96.85.163: icmp
20:55:56.743852 IP lamponubuntu2204-s-1vcpu-1gb-tor1-01 > 198.96.85.163: icmp
20:55:56.853890 IP lamponubuntu2204-s-1vcpu-1gb-tor1-01.47274 > 67.207.67.2.domain: 52000+ PTR? 64.66.156.94.in-addr.arpa. (43)
20:55:56.854049 IP lamponubuntu2204-s-1vcpu-1gb-tor1-01.57587 > 67.207.67.2.domain: 11922+ PTR? 64.66.156.94.in-addr.arpa. (43)
20:55:56.854100 IP lamponubuntu2204-s-1vcpu-1gb-tor1-01.36878 > 67.207.67.2.domain: Flags [S], seq 1222117895, win 64240, options [mss 1460,sackOK,TS val 3582655703 ecr 0,nop,wscale 7,tfo  cookiereq,nop,nop], length 0
20:55:56.854640 IP 67.207.67.2.domain > lamponubuntu2204-s-1vcpu-1gb-tor1-01.36878: Flags [S.], seq 37295744, ack 1222117896, win 65160, options [mss 1460,sackOK,TS val 277139657 ecr 3582655703,nop,wscale 9], length 0
20:55:56.854682 IP lamponubuntu2204-s-1vcpu-1gb-tor1-01.36878 > 67.207.67.2.domain: Flags [.], ack 1, win 502, options [nop,nop,TS val 3582655704 ecr 277139657], length 0
20:55:56.854717 IP lamponubuntu2204-s-1vcpu-1gb-tor1-01.36878 > 67.207.67.2.domain: Flags [P.], seq 1:46, ack 1, win 502, options [nop,nop,TS val 3582655704 ecr 277139657], length 45 3963+ PTR? 64.66.156.94.in-addr.arpa. (43)
20:55:56.855172 IP 67.207.67.2.domain > lamponubuntu2204-s-1vcpu-1gb-tor1-01.36878: Flags [.], ack 46, win 128, options [nop,nop,TS val 277139658 ecr 3582655704], length 0
20:55:56.932146 IP 67.207.67.2.domain > lamponubuntu2204-s-1vcpu-1gb-tor1-01.57587: 11922 NXDomain 0/1/0 (103)
20:55:56.932224 IP 67.207.67.2.domain > lamponubuntu2204-s-1vcpu-1gb-tor1-01.47274: 52000 NXDomain 0/1/0 (103)
20:55:56.934600 IP 67.207.67.2.domain > lamponubuntu2204-s-1vcpu-1gb-tor1-01.36878: Flags [P.], seq 1:106, ack 46, win 128, options [nop,nop,TS val 277139737 ecr 3582655704], length 105 3963 NXDomain 0/1/0 (103)
20:55:56.934645 IP lamponubuntu2204-s-1vcpu-1gb-tor1-01.36878 > 67.207.67.2.domain: Flags [.], ack 106, win 502, options [nop,nop,TS val 3582655784 ecr 277139737], length 0
20:55:57.744412 IP 198.96.85.163 > lamponubuntu2204-s-1vcpu-1gb-tor1-01: ICMP echo request, id 3, seq 12, length 1480
20:55:57.744412 IP 198.96.85.163 > lamponubuntu2204-s-1vcpu-1gb-tor1-01: icmp
20:55:57.744412 IP 198.96.85.163 > lamponubuntu2204-s-1vcpu-1gb-tor1-01: icmp
20:55:57.744482 IP lamponubuntu2204-s-1vcpu-1gb-tor1-01 > 198.96.85.163: ICMP echo reply, id 3, seq 12, length 1480
20:55:57.744498 IP lamponubuntu2204-s-1vcpu-1gb-tor1-01 > 198.96.85.163: icmp
20:55:57.744500 IP lamponubuntu2204-s-1vcpu-1gb-tor1-01 > 198.96.85.163: icmp
20:55:58.748199 IP 198.96.85.163 > lamponubuntu2204-s-1vcpu-1gb-tor1-01: ICMP echo request, id 3, seq 13, length 1480
20:55:58.748199 IP 198.96.85.163 > lamponubuntu2204-s-1vcpu-1gb-tor1-01: icmp
20:55:58.748200 IP 198.96.85.163 > lamponubuntu2204-s-1vcpu-1gb-tor1-01: icmp
20:55:58.748303 IP lamponubuntu2204-s-1vcpu-1gb-tor1-01 > 198.96.85.163: ICMP echo reply, id 3, seq 13, length 1480
20:55:58.748320 IP lamponubuntu2204-s-1vcpu-1gb-tor1-01 > 198.96.85.163: icmp
20:55:58.748321 IP lamponubuntu2204-s-1vcpu-1gb-tor1-01 > 198.96.85.163: icmp
20:55:59.037815 IP 67.207.67.2.domain > lamponubuntu2204-s-1vcpu-1gb-tor1-01.36878: Flags [F.], seq 106, ack 46, win 128, options [nop,nop,TS val 277141840 ecr 3582655784], length 0
20:55:59.037980 IP lamponubuntu2204-s-1vcpu-1gb-tor1-01.36878 > 67.207.67.2.domain: Flags [F.], seq 46, ack 107, win 502, options [nop,nop,TS val 3582657887 ecr 277141840], length 0
20:55:59.038402 IP 67.207.67.2.domain > lamponubuntu2204-s-1vcpu-1gb-tor1-01.36878: Flags [.], ack 47, win 128, options [nop,nop,TS val 277141841 ecr 3582657887], length 0
20:55:59.748829 IP 198.96.85.163 > lamponubuntu2204-s-1vcpu-1gb-tor1-01: ICMP echo request, id 3, seq 14, length 1480
20:55:59.748829 IP 198.96.85.163 > lamponubuntu2204-s-1vcpu-1gb-tor1-01: icmp
20:55:59.748829 IP 198.96.85.163 > lamponubuntu2204-s-1vcpu-1gb-tor1-01: icmp
20:55:59.748909 IP lamponubuntu2204-s-1vcpu-1gb-tor1-01 > 198.96.85.163: ICMP echo reply, id 3, seq 14, length 1480
20:55:59.748927 IP lamponubuntu2204-s-1vcpu-1gb-tor1-01 > 198.96.85.163: icmp
20:55:59.748930 IP lamponubuntu2204-s-1vcpu-1gb-tor1-01 > 198.96.85.163: icmp
20:56:00.749989 IP 198.96.85.163 > lamponubuntu2204-s-1vcpu-1gb-tor1-01: ICMP echo request, id 3, seq 15, length 1480
20:56:00.749990 IP 198.96.85.163 > lamponubuntu2204-s-1vcpu-1gb-tor1-01: icmp
20:56:00.749990 IP 198.96.85.163 > lamponubuntu2204-s-1vcpu-1gb-tor1-01: icmp
20:56:00.750070 IP lamponubuntu2204-s-1vcpu-1gb-tor1-01 > 198.96.85.163: ICMP echo reply, id 3, seq 15, length 1480
20:56:00.750086 IP lamponubuntu2204-s-1vcpu-1gb-tor1-01 > 198.96.85.163: icmp
20:56:00.750088 IP lamponubuntu2204-s-1vcpu-1gb-tor1-01 > 198.96.85.163: icmp
20:56:01.750912 IP 198.96.85.163 > lamponubuntu2204-s-1vcpu-1gb-tor1-01: ICMP echo request, id 3, seq 16, length 1480
20:56:01.750912 IP 198.96.85.163 > lamponubuntu2204-s-1vcpu-1gb-tor1-01: icmp
20:56:01.750912 IP 198.96.85.163 > lamponubuntu2204-s-1vcpu-1gb-tor1-01: icmp
20:56:01.750968 IP lamponubuntu2204-s-1vcpu-1gb-tor1-01 > 198.96.85.163: ICMP echo reply, id 3, seq 16, length 1480
20:56:01.750980 IP lamponubuntu2204-s-1vcpu-1gb-tor1-01 > 198.96.85.163: icmp
20:56:01.750981 IP lamponubuntu2204-s-1vcpu-1gb-tor1-01 > 198.96.85.163: icmp
20:56:02.036001 IP 134.209.144.12.37516 > lamponubuntu2204-s-1vcpu-1gb-tor1-01.ssh: Flags [S], seq 668279016, win 29200, options [mss 1460,sackOK,TS val 418186853 ecr 0,nop,wscale 7], length 0
20:56:02.036192 IP lamponubuntu2204-s-1vcpu-1gb-tor1-01.ssh > 134.209.144.12.37516: Flags [S.], seq 638202775, ack 668279017, win 65160, options [mss 1460,sackOK,TS val 1614707656 ecr 418186853,nop,wscale 7], length 0
20:56:02.286366 IP 134.209.144.12.37516 > lamponubuntu2204-s-1vcpu-1gb-tor1-01.ssh: Flags [.], ack 1, win 229, options [nop,nop,TS val 418187104 ecr 1614707656], length 0
20:56:02.292057 IP 134.209.144.12.37516 > lamponubuntu2204-s-1vcpu-1gb-tor1-01.ssh: Flags [P.], seq 1:23, ack 1, win 229, options [nop,nop,TS val 418187110 ecr 1614707656], length 22: SSH: SSH-2.0-libssh_0.9.6
20:56:02.292099 IP lamponubuntu2204-s-1vcpu-1gb-tor1-01.ssh > 134.209.144.12.37516: Flags [.], ack 23, win 509, options [nop,nop,TS val 1614707912 ecr 418187110], length 0
20:56:02.301463 IP lamponubuntu2204-s-1vcpu-1gb-tor1-01.ssh > 134.209.144.12.37516: Flags [P.], seq 1:42, ack 23, win 509, options [nop,nop,TS val 1614707922 ecr 418187110], length 41: SSH: SSH-2.0-OpenSSH_8.9p1 Ubuntu-3ubuntu0.6
20:56:02.551091 IP 134.209.144.12.37516 > lamponubuntu2204-s-1vcpu-1gb-tor1-01.ssh: Flags [.], ack 42, win 229, options [nop,nop,TS val 418187369 ecr 1614707922], length 0
20:56:02.551245 IP lamponubuntu2204-s-1vcpu-1gb-tor1-01.ssh > 134.209.144.12.37516: Flags [P.], seq 42:1154, ack 23, win 509, options [nop,nop,TS val 1614708172 ecr 418187369], length 1112
20:56:02.556000 IP 134.209.144.12.37516 > lamponubuntu2204-s-1vcpu-1gb-tor1-01.ssh: Flags [P.], seq 23:999, ack 42, win 229, options [nop,nop,TS val 418187374 ecr 1614707922], length 976
20:56:02.597230 IP lamponubuntu2204-s-1vcpu-1gb-tor1-01.ssh > 134.209.144.12.37516: Flags [.], ack 999, win 502, options [nop,nop,TS val 1614708218 ecr 418187374], length 0
20:56:02.754285 IP 198.96.85.163 > lamponubuntu2204-s-1vcpu-1gb-tor1-01: ICMP echo request, id 3, seq 17, length 1480
20:56:02.754285 IP 198.96.85.163 > lamponubuntu2204-s-1vcpu-1gb-tor1-01: icmp
20:56:02.754285 IP 198.96.85.163 > lamponubuntu2204-s-1vcpu-1gb-tor1-01: icmp
20:56:02.754350 IP lamponubuntu2204-s-1vcpu-1gb-tor1-01 > 198.96.85.163: ICMP echo reply, id 3, seq 17, length 1480
20:56:02.754365 IP lamponubuntu2204-s-1vcpu-1gb-tor1-01 > 198.96.85.163: icmp
20:56:02.754367 IP lamponubuntu2204-s-1vcpu-1gb-tor1-01 > 198.96.85.163: icmp
20:56:02.840770 IP 134.209.144.12.37516 > lamponubuntu2204-s-1vcpu-1gb-tor1-01.ssh: Flags [.], ack 1154, win 246, options [nop,nop,TS val 418187659 ecr 1614708172], length 0
20:56:02.846829 IP 134.209.144.12.37516 > lamponubuntu2204-s-1vcpu-1gb-tor1-01.ssh: Flags [P.], seq 999:1047, ack 1154, win 246, options [nop,nop,TS val 418187665 ecr 1614708218], length 48
20:56:02.846882 IP lamponubuntu2204-s-1vcpu-1gb-tor1-01.ssh > 134.209.144.12.37516: Flags [.], ack 1047, win 502, options [nop,nop,TS val 1614708467 ecr 418187665], length 0
20:56:02.856300 IP lamponubuntu2204-s-1vcpu-1gb-tor1-01.ssh > 134.209.144.12.37516: Flags [P.], seq 1154:1686, ack 1047, win 502, options [nop,nop,TS val 1614708477 ecr 418187665], length 532
20:56:02.997777 IP lamponubuntu2204-s-1vcpu-1gb-tor1-01.48320 > 67.207.67.2.domain: 36229+ PTR? 12.144.209.134.in-addr.arpa. (45)
20:56:02.997898 IP lamponubuntu2204-s-1vcpu-1gb-tor1-01.46989 > 67.207.67.2.domain: 24078+ PTR? 12.144.209.134.in-addr.arpa. (45)
20:56:02.997943 IP lamponubuntu2204-s-1vcpu-1gb-tor1-01.41722 > 67.207.67.2.domain: Flags [S], seq 220698350, win 64240, options [mss 1460,sackOK,TS val 3582661847 ecr 0,nop,wscale 7,tfo  cookiereq,nop,nop], length 0
20:56:02.998312 IP 67.207.67.2.domain > lamponubuntu2204-s-1vcpu-1gb-tor1-01.48320: 36229 NXDomain 0/1/0 (112)
20:56:02.998385 IP 67.207.67.2.domain > lamponubuntu2204-s-1vcpu-1gb-tor1-01.46989: 24078 NXDomain 0/1/0 (112)
20:56:02.998422 IP 67.207.67.2.domain > lamponubuntu2204-s-1vcpu-1gb-tor1-01.41722: Flags [S.], seq 1113812463, ack 220698351, win 65160, options [mss 1460,sackOK,TS val 277145801 ecr 3582661847,nop,wscale 9], length 0
20:56:02.998446 IP lamponubuntu2204-s-1vcpu-1gb-tor1-01.41722 > 67.207.67.2.domain: Flags [.], ack 1, win 502, options [nop,nop,TS val 3582661848 ecr 277145801], length 0
20:56:02.998520 IP lamponubuntu2204-s-1vcpu-1gb-tor1-01.41722 > 67.207.67.2.domain: Flags [P.], seq 1:48, ack 1, win 502, options [nop,nop,TS val 3582661848 ecr 277145801], length 47 27401+ PTR? 12.144.209.134.in-addr.arpa. (45)
20:56:02.999015 IP 67.207.67.2.domain > lamponubuntu2204-s-1vcpu-1gb-tor1-01.41722: Flags [.], ack 48, win 128, options [nop,nop,TS val 277145802 ecr 3582661848], length 0
20:56:02.999869 IP 67.207.67.2.domain > lamponubuntu2204-s-1vcpu-1gb-tor1-01.41722: Flags [P.], seq 1:115, ack 48, win 128, options [nop,nop,TS val 277145803 ecr 3582661848], length 114 27401 NXDomain 0/1/0 (112)
20:56:02.999991 IP lamponubuntu2204-s-1vcpu-1gb-tor1-01.41722 > 67.207.67.2.domain: Flags [.], ack 115, win 502, options [nop,nop,TS val 3582661849 ecr 277145803], length 0
20:56:03.106092 IP 134.209.144.12.37516 > lamponubuntu2204-s-1vcpu-1gb-tor1-01.ssh: Flags [.], ack 1686, win 263, options [nop,nop,TS val 418187924 ecr 1614708477], length 0
20:56:03.109556 IP 134.209.144.12.37516 > lamponubuntu2204-s-1vcpu-1gb-tor1-01.ssh: Flags [P.], seq 1047:1063, ack 1686, win 263, options [nop,nop,TS val 418187927 ecr 1614708477], length 16
20:56:03.153226 IP lamponubuntu2204-s-1vcpu-1gb-tor1-01.ssh > 134.209.144.12.37516: Flags [.], ack 1063, win 502, options [nop,nop,TS val 1614708774 ecr 418187927], length 0
20:56:03.402918 IP 134.209.144.12.37516 > lamponubuntu2204-s-1vcpu-1gb-tor1-01.ssh: Flags [P.], seq 1063:1115, ack 1686, win 263, options [nop,nop,TS val 418188221 ecr 1614708774], length 52
20:56:03.402975 IP lamponubuntu2204-s-1vcpu-1gb-tor1-01.ssh > 134.209.144.12.37516: Flags [.], ack 1115, win 502, options [nop,nop,TS val 1614709023 ecr 418188221], length 0
20:56:03.403110 IP lamponubuntu2204-s-1vcpu-1gb-tor1-01.ssh > 134.209.144.12.37516: Flags [P.], seq 1686:1738, ack 1115, win 502, options [nop,nop,TS val 1614709023 ecr 418188221], length 52
20:56:03.658691 IP 134.209.144.12.37516 > lamponubuntu2204-s-1vcpu-1gb-tor1-01.ssh: Flags [P.], seq 1115:1199, ack 1738, win 263, options [nop,nop,TS val 418188477 ecr 1614709023], length 84
20:56:03.664372 IP lamponubuntu2204-s-1vcpu-1gb-tor1-01.ssh > 134.209.144.12.37516: Flags [P.], seq 1738:1790, ack 1199, win 502, options [nop,nop,TS val 1614709285 ecr 418188477], length 52
20:56:03.755072 IP 198.96.85.163 > lamponubuntu2204-s-1vcpu-1gb-tor1-01: ICMP echo request, id 3, seq 18, length 1480
20:56:03.755072 IP 198.96.85.163 > lamponubuntu2204-s-1vcpu-1gb-tor1-01: icmp
20:56:03.755072 IP 198.96.85.163 > lamponubuntu2204-s-1vcpu-1gb-tor1-01: icmp
20:56:03.755131 IP lamponubuntu2204-s-1vcpu-1gb-tor1-01 > 198.96.85.163: ICMP echo reply, id 3, seq 18, length 1480
20:56:03.755148 IP lamponubuntu2204-s-1vcpu-1gb-tor1-01 > 198.96.85.163: icmp
20:56:03.755149 IP lamponubuntu2204-s-1vcpu-1gb-tor1-01 > 198.96.85.163: icmp
20:56:03.917837 IP 134.209.144.12.37516 > lamponubuntu2204-s-1vcpu-1gb-tor1-01.ssh: Flags [P.], seq 1199:1251, ack 1790, win 263, options [nop,nop,TS val 418188736 ecr 1614709285], length 52
20:56:03.917838 IP 134.209.144.12.37516 > lamponubuntu2204-s-1vcpu-1gb-tor1-01.ssh: Flags [F.], seq 1251, ack 1790, win 263, options [nop,nop,TS val 418188736 ecr 1614709285], length 0
20:56:03.920823 IP lamponubuntu2204-s-1vcpu-1gb-tor1-01.ssh > 134.209.144.12.37516: Flags [F.], seq 1790, ack 1252, win 502, options [nop,nop,TS val 1614709541 ecr 418188736], length 0
20:56:04.170373 IP 134.209.144.12.37516 > lamponubuntu2204-s-1vcpu-1gb-tor1-01.ssh: Flags [.], ack 1791, win 263, options [nop,nop,TS val 418188988 ecr 1614709541], length 0
20:56:04.756550 IP 198.96.85.163 > lamponubuntu2204-s-1vcpu-1gb-tor1-01: ICMP echo request, id 3, seq 19, length 1480
20:56:04.756551 IP 198.96.85.163 > lamponubuntu2204-s-1vcpu-1gb-tor1-01: icmp
20:56:04.756551 IP 198.96.85.163 > lamponubuntu2204-s-1vcpu-1gb-tor1-01: icmp
20:56:04.756611 IP lamponubuntu2204-s-1vcpu-1gb-tor1-01 > 198.96.85.163: ICMP echo reply, id 3, seq 19, length 1480
20:56:04.756628 IP lamponubuntu2204-s-1vcpu-1gb-tor1-01 > 198.96.85.163: icmp
20:56:04.756629 IP lamponubuntu2204-s-1vcpu-1gb-tor1-01 > 198.96.85.163: icmp
20:56:05.502627 IP 67.207.67.2.domain > lamponubuntu2204-s-1vcpu-1gb-tor1-01.41722: Flags [F.], seq 115, ack 48, win 128, options [nop,nop,TS val 277148305 ecr 3582661849], length 0
20:56:05.502782 IP lamponubuntu2204-s-1vcpu-1gb-tor1-01.41722 > 67.207.67.2.domain: Flags [F.], seq 48, ack 116, win 502, options [nop,nop,TS val 3582664352 ecr 277148305], length 0
20:56:05.503179 IP 67.207.67.2.domain > lamponubuntu2204-s-1vcpu-1gb-tor1-01.41722: Flags [.], ack 49, win 128, options [nop,nop,TS val 277148306 ecr 3582664352], length 0
20:56:05.758001 IP 198.96.85.163 > lamponubuntu2204-s-1vcpu-1gb-tor1-01: ICMP echo request, id 3, seq 20, length 1480
20:56:05.758001 IP 198.96.85.163 > lamponubuntu2204-s-1vcpu-1gb-tor1-01: icmp
20:56:05.758001 IP 198.96.85.163 > lamponubuntu2204-s-1vcpu-1gb-tor1-01: icmp
20:56:05.758062 IP lamponubuntu2204-s-1vcpu-1gb-tor1-01 > 198.96.85.163: ICMP echo reply, id 3, seq 20, length 1480
20:56:05.758076 IP lamponubuntu2204-s-1vcpu-1gb-tor1-01 > 198.96.85.163: icmp
20:56:05.758077 IP lamponubuntu2204-s-1vcpu-1gb-tor1-01 > 198.96.85.163: icmp
20:56:06.759280 IP 198.96.85.163 > lamponubuntu2204-s-1vcpu-1gb-tor1-01: ICMP echo request, id 3, seq 21, length 1480
20:56:06.759280 IP 198.96.85.163 > lamponubuntu2204-s-1vcpu-1gb-tor1-01: icmp
20:56:06.759280 IP 198.96.85.163 > lamponubuntu2204-s-1vcpu-1gb-tor1-01: icmp
20:56:06.759340 IP lamponubuntu2204-s-1vcpu-1gb-tor1-01 > 198.96.85.163: ICMP echo reply, id 3, seq 21, length 1480
20:56:06.759353 IP lamponubuntu2204-s-1vcpu-1gb-tor1-01 > 198.96.85.163: icmp
20:56:06.759354 IP lamponubuntu2204-s-1vcpu-1gb-tor1-01 > 198.96.85.163: icmp
20:56:07.760005 IP 198.96.85.163 > lamponubuntu2204-s-1vcpu-1gb-tor1-01: ICMP echo request, id 3, seq 22, length 1480
20:56:07.760005 IP 198.96.85.163 > lamponubuntu2204-s-1vcpu-1gb-tor1-01: icmp
20:56:07.760006 IP 198.96.85.163 > lamponubuntu2204-s-1vcpu-1gb-tor1-01: icmp
20:56:07.760065 IP lamponubuntu2204-s-1vcpu-1gb-tor1-01 > 198.96.85.163: ICMP echo reply, id 3, seq 22, length 1480
20:56:07.760078 IP lamponubuntu2204-s-1vcpu-1gb-tor1-01 > 198.96.85.163: icmp
20:56:07.760080 IP lamponubuntu2204-s-1vcpu-1gb-tor1-01 > 198.96.85.163: icmp
20:56:08.763053 IP 198.96.85.163 > lamponubuntu2204-s-1vcpu-1gb-tor1-01: ICMP echo request, id 3, seq 23, length 1480
20:56:08.763053 IP 198.96.85.163 > lamponubuntu2204-s-1vcpu-1gb-tor1-01: icmp
20:56:08.763053 IP 198.96.85.163 > lamponubuntu2204-s-1vcpu-1gb-tor1-01: icmp
20:56:08.763128 IP lamponubuntu2204-s-1vcpu-1gb-tor1-01 > 198.96.85.163: ICMP echo reply, id 3, seq 23, length 1480
20:56:08.763239 IP lamponubuntu2204-s-1vcpu-1gb-tor1-01 > 198.96.85.163: icmp
20:56:08.763242 IP lamponubuntu2204-s-1vcpu-1gb-tor1-01 > 198.96.85.163: icmp
20:56:09.764734 IP 198.96.85.163 > lamponubuntu2204-s-1vcpu-1gb-tor1-01: ICMP echo request, id 3, seq 24, length 1480
20:56:09.764734 IP 198.96.85.163 > lamponubuntu2204-s-1vcpu-1gb-tor1-01: icmp
20:56:09.764734 IP 198.96.85.163 > lamponubuntu2204-s-1vcpu-1gb-tor1-01: icmp
20:56:09.764813 IP lamponubuntu2204-s-1vcpu-1gb-tor1-01 > 198.96.85.163: ICMP echo reply, id 3, seq 24, length 1480
20:56:09.764830 IP lamponubuntu2204-s-1vcpu-1gb-tor1-01 > 198.96.85.163: icmp
20:56:09.764832 IP lamponubuntu2204-s-1vcpu-1gb-tor1-01 > 198.96.85.163: icmp
20:56:10.097884 IP cork.scan.bufferover.run.34038 > lamponubuntu2204-s-1vcpu-1gb-tor1-01.10999: Flags [S], seq 2086750159, win 65535, options [mss 1460], length 0
20:56:10.165911 IP lamponubuntu2204-s-1vcpu-1gb-tor1-01.50037 > 67.207.67.2.domain: 19389+ PTR? 117.163.187.170.in-addr.arpa. (46)
20:56:10.166075 IP lamponubuntu2204-s-1vcpu-1gb-tor1-01.54821 > 67.207.67.2.domain: 38340+ PTR? 117.163.187.170.in-addr.arpa. (46)
20:56:10.166122 IP lamponubuntu2204-s-1vcpu-1gb-tor1-01.41738 > 67.207.67.2.domain: Flags [S], seq 320517151, win 64240, options [mss 1460,sackOK,TS val 3582669015 ecr 0,nop,wscale 7,tfo  cookiereq,nop,nop], length 0
