20:20:55.259203 IP lamponubuntu2204-s-1vcpu-1gb-tor1-01.ssh > 198.96.85.163.40012: Flags [P.], seq 2384826562:2384826670, ack 1830331834, win 501, options [nop,nop,TS val 301544626 ecr 2588392385], length 108
20:20:55.259289 IP lamponubuntu2204-s-1vcpu-1gb-tor1-01.ssh > 198.96.85.163.40012: Flags [P.], seq 108:144, ack 1, win 501, options [nop,nop,TS val 301544626 ecr 2588392385], length 36
20:20:55.259305 IP lamponubuntu2204-s-1vcpu-1gb-tor1-01.ssh > 198.96.85.163.40012: Flags [P.], seq 144:196, ack 1, win 501, options [nop,nop,TS val 301544626 ecr 2588392385], length 52
20:20:55.259338 IP lamponubuntu2204-s-1vcpu-1gb-tor1-01.ssh > 198.96.85.163.40012: Flags [P.], seq 196:264, ack 1, win 501, options [nop,nop,TS val 301544626 ecr 2588392385], length 68
20:20:55.259387 IP lamponubuntu2204-s-1vcpu-1gb-tor1-01.ssh > 198.96.85.163.40012: Flags [P.], seq 264:332, ack 1, win 501, options [nop,nop,TS val 301544626 ecr 2588392385], length 68
20:20:55.259430 IP lamponubuntu2204-s-1vcpu-1gb-tor1-01.ssh > 198.96.85.163.40012: Flags [P.], seq 332:368, ack 1, win 501, options [nop,nop,TS val 301544626 ecr 2588392385], length 36
20:20:55.263495 IP 198.96.85.163.40012 > lamponubuntu2204-s-1vcpu-1gb-tor1-01.ssh: Flags [.], ack 108, win 176, options [nop,nop,TS val 2588392395 ecr 301544626], length 0
20:20:55.263495 IP 198.96.85.163.40012 > lamponubuntu2204-s-1vcpu-1gb-tor1-01.ssh: Flags [.], ack 144, win 176, options [nop,nop,TS val 2588392395 ecr 301544626], length 0
20:20:55.264901 IP 198.96.85.163.40012 > lamponubuntu2204-s-1vcpu-1gb-tor1-01.ssh: Flags [.], ack 368, win 175, options [nop,nop,TS val 2588392395 ecr 301544626], length 0
20:20:56.278156 IP lamponubuntu2204-s-1vcpu-1gb-tor1-01.42955 > 67.207.67.3.domain: 63125+ [1au] PTR? 163.85.96.198.in-addr.arpa. (55)
20:20:56.278310 IP lamponubuntu2204-s-1vcpu-1gb-tor1-01.42371 > 67.207.67.3.domain: 48235+ [1au] PTR? 163.85.96.198.in-addr.arpa. (55)
20:20:56.279598 IP 67.207.67.3.domain > lamponubuntu2204-s-1vcpu-1gb-tor1-01.42371: 48235 NXDomain 0/1/1 (120)
20:20:56.279598 IP 67.207.67.3.domain > lamponubuntu2204-s-1vcpu-1gb-tor1-01.42955: 63125 NXDomain 0/1/1 (120)
20:20:56.279723 IP lamponubuntu2204-s-1vcpu-1gb-tor1-01.42371 > 67.207.67.3.domain: 48235+ PTR? 163.85.96.198.in-addr.arpa. (44)
20:20:56.279881 IP lamponubuntu2204-s-1vcpu-1gb-tor1-01.42955 > 67.207.67.3.domain: 63125+ PTR? 163.85.96.198.in-addr.arpa. (44)
20:20:56.280081 IP 67.207.67.3.domain > lamponubuntu2204-s-1vcpu-1gb-tor1-01.42371: 48235 NXDomain 0/1/0 (109)
20:20:56.280205 IP 67.207.67.3.domain > lamponubuntu2204-s-1vcpu-1gb-tor1-01.42955: 63125 NXDomain 0/1/0 (109)
20:20:59.901854 IP6 lamponubuntu2204-s-1vcpu-1gb-tor1-01 > ip6-allrouters: ICMP6, router solicitation, length 16
20:20:59.977700 IP 198.96.85.163.60440 > lamponubuntu2204-s-1vcpu-1gb-tor1-01.ssh: Flags [P.], seq 2424799417:2424799453, ack 3846566733, win 726, options [nop,nop,TS val 2588397108 ecr 301527094], length 36
20:20:59.978061 IP lamponubuntu2204-s-1vcpu-1gb-tor1-01.ssh > 198.96.85.163.60440: Flags [P.], seq 1:37, ack 36, win 501, options [nop,nop,TS val 301549344 ecr 2588397108], length 36
20:20:59.980450 IP 198.96.85.163.60440 > lamponubuntu2204-s-1vcpu-1gb-tor1-01.ssh: Flags [.], ack 37, win 726, options [nop,nop,TS val 2588397112 ecr 301549344], length 0
20:21:00.211808 IP 198.96.85.163.60440 > lamponubuntu2204-s-1vcpu-1gb-tor1-01.ssh: Flags [P.], seq 36:72, ack 37, win 726, options [nop,nop,TS val 2588397342 ecr 301549344], length 36
20:21:00.212092 IP lamponubuntu2204-s-1vcpu-1gb-tor1-01.ssh > 198.96.85.163.60440: Flags [P.], seq 37:73, ack 72, win 501, options [nop,nop,TS val 301549578 ecr 2588397342], length 36
20:21:00.214565 IP 198.96.85.163.60440 > lamponubuntu2204-s-1vcpu-1gb-tor1-01.ssh: Flags [.], ack 73, win 726, options [nop,nop,TS val 2588397346 ecr 301549578], length 0
20:21:00.290041 IP 198.96.85.163.60440 > lamponubuntu2204-s-1vcpu-1gb-tor1-01.ssh: Flags [P.], seq 72:108, ack 73, win 726, options [nop,nop,TS val 2588397422 ecr 301549578], length 36
20:21:00.296638 IP lamponubuntu2204-s-1vcpu-1gb-tor1-01.ssh > 198.96.85.163.60440: Flags [P.], seq 73:109, ack 108, win 501, options [nop,nop,TS val 301549663 ecr 2588397422], length 36
20:21:00.299028 IP 198.96.85.163.60440 > lamponubuntu2204-s-1vcpu-1gb-tor1-01.ssh: Flags [.], ack 109, win 726, options [nop,nop,TS val 2588397431 ecr 301549663], length 0
20:21:00.368517 IP 198.96.85.163.60440 > lamponubuntu2204-s-1vcpu-1gb-tor1-01.ssh: Flags [P.], seq 108:144, ack 109, win 726, options [nop,nop,TS val 2588397500 ecr 301549663], length 36
20:21:00.368863 IP lamponubuntu2204-s-1vcpu-1gb-tor1-01.ssh > 198.96.85.163.60440: Flags [P.], seq 109:145, ack 144, win 501, options [nop,nop,TS val 301549735 ecr 2588397500], length 36
20:21:00.371834 IP 198.96.85.163.60440 > lamponubuntu2204-s-1vcpu-1gb-tor1-01.ssh: Flags [.], ack 145, win 726, options [nop,nop,TS val 2588397503 ecr 301549735], length 0
20:21:00.491941 IP 186-250-47-238.bvnetfibras.net.br.60630 > lamponubuntu2204-s-1vcpu-1gb-tor1-01.ssh: Flags [S], seq 650413504, win 64240, options [mss 1460,sackOK,TS val 280100086 ecr 0,nop,wscale 7], length 0
20:21:00.492017 IP lamponubuntu2204-s-1vcpu-1gb-tor1-01.ssh > 186-250-47-238.bvnetfibras.net.br.60630: Flags [S.], seq 3305585167, ack 650413505, win 65160, options [mss 1460,sackOK,TS val 1869452694 ecr 280100086,nop,wscale 7], length 0
20:21:00.526389 IP 198.96.85.163.60440 > lamponubuntu2204-s-1vcpu-1gb-tor1-01.ssh: Flags [P.], seq 144:180, ack 145, win 726, options [nop,nop,TS val 2588397657 ecr 301549735], length 36
20:21:00.526734 IP lamponubuntu2204-s-1vcpu-1gb-tor1-01.ssh > 198.96.85.163.60440: Flags [P.], seq 145:181, ack 180, win 501, options [nop,nop,TS val 301549893 ecr 2588397657], length 36
20:21:00.529077 IP 198.96.85.163.60440 > lamponubuntu2204-s-1vcpu-1gb-tor1-01.ssh: Flags [.], ack 181, win 726, options [nop,nop,TS val 2588397661 ecr 301549893], length 0
20:21:00.661760 IP 186-250-47-238.bvnetfibras.net.br.60630 > lamponubuntu2204-s-1vcpu-1gb-tor1-01.ssh: Flags [.], ack 1, win 502, options [nop,nop,TS val 280100258 ecr 1869452694], length 0
20:21:00.661760 IP 186-250-47-238.bvnetfibras.net.br.60630 > lamponubuntu2204-s-1vcpu-1gb-tor1-01.ssh: Flags [P.], seq 1:23, ack 1, win 502, options [nop,nop,TS val 280100258 ecr 1869452694], length 22: SSH: SSH-2.0-libssh_0.9.6
20:21:00.661877 IP lamponubuntu2204-s-1vcpu-1gb-tor1-01.ssh > 186-250-47-238.bvnetfibras.net.br.60630: Flags [.], ack 23, win 509, options [nop,nop,TS val 1869452864 ecr 280100258], length 0
20:21:00.678186 IP lamponubuntu2204-s-1vcpu-1gb-tor1-01.ssh > 186-250-47-238.bvnetfibras.net.br.60630: Flags [P.], seq 1:42, ack 23, win 509, options [nop,nop,TS val 1869452881 ecr 280100258], length 41: SSH: SSH-2.0-OpenSSH_8.9p1 Ubuntu-3ubuntu0.6
20:21:00.844428 IP 186-250-47-238.bvnetfibras.net.br.60630 > lamponubuntu2204-s-1vcpu-1gb-tor1-01.ssh: Flags [.], ack 42, win 502, options [nop,nop,TS val 280100443 ecr 1869452881], length 0
20:21:00.844488 IP lamponubuntu2204-s-1vcpu-1gb-tor1-01.ssh > 186-250-47-238.bvnetfibras.net.br.60630: Flags [P.], seq 42:1154, ack 23, win 509, options [nop,nop,TS val 1869453047 ecr 280100443], length 1112
20:21:00.844511 IP 186-250-47-238.bvnetfibras.net.br.60630 > lamponubuntu2204-s-1vcpu-1gb-tor1-01.ssh: Flags [P.], seq 23:999, ack 42, win 502, options [nop,nop,TS val 280100443 ecr 1869452881], length 976
20:21:00.885217 IP lamponubuntu2204-s-1vcpu-1gb-tor1-01.ssh > 186-250-47-238.bvnetfibras.net.br.60630: Flags [.], ack 999, win 502, options [nop,nop,TS val 1869453088 ecr 280100443], length 0
20:21:01.014424 IP 186-250-47-238.bvnetfibras.net.br.60630 > lamponubuntu2204-s-1vcpu-1gb-tor1-01.ssh: Flags [.], ack 1154, win 501, options [nop,nop,TS val 280100610 ecr 1869453047], length 0
20:21:01.056114 IP 186-250-47-238.bvnetfibras.net.br.60630 > lamponubuntu2204-s-1vcpu-1gb-tor1-01.ssh: Flags [P.], seq 999:1047, ack 1154, win 501, options [nop,nop,TS val 280100650 ecr 1869453088], length 48
20:21:01.056167 IP lamponubuntu2204-s-1vcpu-1gb-tor1-01.ssh > 186-250-47-238.bvnetfibras.net.br.60630: Flags [.], ack 1047, win 502, options [nop,nop,TS val 1869453259 ecr 280100650], length 0
20:21:01.064328 IP lamponubuntu2204-s-1vcpu-1gb-tor1-01.ssh > 186-250-47-238.bvnetfibras.net.br.60630: Flags [P.], seq 1154:1686, ack 1047, win 502, options [nop,nop,TS val 1869453267 ecr 280100650], length 532
20:21:01.134196 IP 198.96.85.163.60440 > lamponubuntu2204-s-1vcpu-1gb-tor1-01.ssh: Flags [P.], seq 180:216, ack 181, win 726, options [nop,nop,TS val 2588398253 ecr 301549893], length 36
20:21:01.134569 IP lamponubuntu2204-s-1vcpu-1gb-tor1-01.ssh > 198.96.85.163.60440: Flags [P.], seq 181:217, ack 216, win 501, options [nop,nop,TS val 301550501 ecr 2588398253], length 36
20:21:01.138727 IP 198.96.85.163.60440 > lamponubuntu2204-s-1vcpu-1gb-tor1-01.ssh: Flags [.], ack 217, win 726, options [nop,nop,TS val 2588398270 ecr 301550501], length 0
20:21:01.234746 IP 186-250-47-238.bvnetfibras.net.br.60630 > lamponubuntu2204-s-1vcpu-1gb-tor1-01.ssh: Flags [.], ack 1686, win 501, options [nop,nop,TS val 280100829 ecr 1869453267], length 0
20:21:01.234809 IP 186-250-47-238.bvnetfibras.net.br.60630 > lamponubuntu2204-s-1vcpu-1gb-tor1-01.ssh: Flags [P.], seq 1047:1063, ack 1686, win 501, options [nop,nop,TS val 280100830 ecr 1869453267], length 16
20:21:01.244157 IP 150.109.252.123.58566 > lamponubuntu2204-s-1vcpu-1gb-tor1-01.ssh: Flags [S], seq 131002946, win 29200, options [mss 1424,sackOK,TS val 1920325641 ecr 0,nop,wscale 7], length 0
20:21:01.244243 IP lamponubuntu2204-s-1vcpu-1gb-tor1-01.ssh > 150.109.252.123.58566: Flags [S.], seq 986176080, ack 131002947, win 65160, options [mss 1460,sackOK,TS val 554315151 ecr 1920325641,nop,wscale 7], length 0
20:21:01.277281 IP lamponubuntu2204-s-1vcpu-1gb-tor1-01.ssh > 186-250-47-238.bvnetfibras.net.br.60630: Flags [.], ack 1063, win 502, options [nop,nop,TS val 1869453480 ecr 280100830], length 0
20:21:01.423493 IP 198.96.85.163.60440 > lamponubuntu2204-s-1vcpu-1gb-tor1-01.ssh: Flags [P.], seq 216:300, ack 217, win 726, options [nop,nop,TS val 2588398553 ecr 301550501], length 84
20:21:01.423838 IP lamponubuntu2204-s-1vcpu-1gb-tor1-01.ssh > 198.96.85.163.60440: Flags [P.], seq 217:301, ack 300, win 501, options [nop,nop,TS val 301550790 ecr 2588398553], length 84
20:21:01.428058 IP 198.96.85.163.60440 > lamponubuntu2204-s-1vcpu-1gb-tor1-01.ssh: Flags [.], ack 301, win 726, options [nop,nop,TS val 2588398560 ecr 301550790], length 0
20:21:01.432614 IP 150.109.252.123.58566 > lamponubuntu2204-s-1vcpu-1gb-tor1-01.ssh: Flags [.], ack 1, win 229, options [nop,nop,TS val 1920325830 ecr 554315151], length 0
20:21:01.438231 IP 150.109.252.123.58566 > lamponubuntu2204-s-1vcpu-1gb-tor1-01.ssh: Flags [P.], seq 1:23, ack 1, win 229, options [nop,nop,TS val 1920325835 ecr 554315151], length 22: SSH: SSH-2.0-libssh_0.9.6
20:21:01.438294 IP lamponubuntu2204-s-1vcpu-1gb-tor1-01.ssh > 150.109.252.123.58566: Flags [.], ack 23, win 509, options [nop,nop,TS val 554315345 ecr 1920325835], length 0
20:21:01.442702 IP 186-250-47-238.bvnetfibras.net.br.60630 > lamponubuntu2204-s-1vcpu-1gb-tor1-01.ssh: Flags [P.], seq 1063:1115, ack 1686, win 501, options [nop,nop,TS val 280101042 ecr 1869453480], length 52
20:21:01.442740 IP lamponubuntu2204-s-1vcpu-1gb-tor1-01.ssh > 186-250-47-238.bvnetfibras.net.br.60630: Flags [.], ack 1115, win 502, options [nop,nop,TS val 1869453645 ecr 280101042], length 0
20:21:01.442827 IP lamponubuntu2204-s-1vcpu-1gb-tor1-01.ssh > 186-250-47-238.bvnetfibras.net.br.60630: Flags [P.], seq 1686:1738, ack 1115, win 502, options [nop,nop,TS val 1869453645 ecr 280101042], length 52
20:21:01.449545 IP lamponubuntu2204-s-1vcpu-1gb-tor1-01.ssh > 150.109.252.123.58566: Flags [P.], seq 1:42, ack 23, win 509, options [nop,nop,TS val 554315356 ecr 1920325835], length 41: SSH: SSH-2.0-OpenSSH_8.9p1 Ubuntu-3ubuntu0.6
20:21:01.607907 IP 186-250-47-238.bvnetfibras.net.br.60630 > lamponubuntu2204-s-1vcpu-1gb-tor1-01.ssh: Flags [.], ack 1738, win 501, options [nop,nop,TS val 280101208 ecr 1869453645], length 0
20:21:01.607907 IP 186-250-47-238.bvnetfibras.net.br.60630 > lamponubuntu2204-s-1vcpu-1gb-tor1-01.ssh: Flags [P.], seq 1115:1199, ack 1738, win 501, options [nop,nop,TS val 280101208 ecr 1869453645], length 84
20:21:01.613870 IP lamponubuntu2204-s-1vcpu-1gb-tor1-01.ssh > 186-250-47-238.bvnetfibras.net.br.60630: Flags [P.], seq 1738:1790, ack 1199, win 502, options [nop,nop,TS val 1869453816 ecr 280101208], length 52
20:21:01.637317 IP 150.109.252.123.58566 > lamponubuntu2204-s-1vcpu-1gb-tor1-01.ssh: Flags [.], ack 42, win 229, options [nop,nop,TS val 1920326035 ecr 554315356], length 0
20:21:01.637366 IP lamponubuntu2204-s-1vcpu-1gb-tor1-01.ssh > 150.109.252.123.58566: Flags [P.], seq 42:1154, ack 23, win 509, options [nop,nop,TS val 554315544 ecr 1920326035], length 1112
20:21:01.641350 IP 198.96.85.163.60440 > lamponubuntu2204-s-1vcpu-1gb-tor1-01.ssh: Flags [P.], seq 300:336, ack 301, win 726, options [nop,nop,TS val 2588398734 ecr 301550790], length 36
20:21:01.641637 IP lamponubuntu2204-s-1vcpu-1gb-tor1-01.ssh > 198.96.85.163.60440: Flags [P.], seq 301:409, ack 336, win 501, options [nop,nop,TS val 301551008 ecr 2588398734], length 108
20:21:01.644103 IP 198.96.85.163.60440 > lamponubuntu2204-s-1vcpu-1gb-tor1-01.ssh: Flags [.], ack 409, win 726, options [nop,nop,TS val 2588398776 ecr 301551008], length 0
20:21:01.645555 IP 150.109.252.123.58566 > lamponubuntu2204-s-1vcpu-1gb-tor1-01.ssh: Flags [P.], seq 23:999, ack 42, win 229, options [nop,nop,TS val 1920326043 ecr 554315356], length 976
20:21:01.689233 IP lamponubuntu2204-s-1vcpu-1gb-tor1-01.ssh > 150.109.252.123.58566: Flags [.], ack 999, win 502, options [nop,nop,TS val 554315596 ecr 1920326043], length 0
20:21:01.784723 IP 186-250-47-238.bvnetfibras.net.br.60630 > lamponubuntu2204-s-1vcpu-1gb-tor1-01.ssh: Flags [P.], seq 1199:1251, ack 1790, win 501, options [nop,nop,TS val 280101379 ecr 1869453816], length 52
20:21:01.784809 IP 186-250-47-238.bvnetfibras.net.br.60630 > lamponubuntu2204-s-1vcpu-1gb-tor1-01.ssh: Flags [F.], seq 1251, ack 1790, win 501, options [nop,nop,TS val 280101379 ecr 1869453816], length 0
20:21:01.787978 IP lamponubuntu2204-s-1vcpu-1gb-tor1-01.ssh > 186-250-47-238.bvnetfibras.net.br.60630: Flags [F.], seq 1790, ack 1252, win 502, options [nop,nop,TS val 1869453990 ecr 280101379], length 0
20:21:01.865224 IP 150.109.252.123.58566 > lamponubuntu2204-s-1vcpu-1gb-tor1-01.ssh: Flags [.], ack 1154, win 246, options [nop,nop,TS val 1920326262 ecr 554315544], length 0
20:21:01.876962 IP 150.109.252.123.58566 > lamponubuntu2204-s-1vcpu-1gb-tor1-01.ssh: Flags [P.], seq 999:1047, ack 1154, win 246, options [nop,nop,TS val 1920326274 ecr 554315596], length 48
20:21:01.877017 IP lamponubuntu2204-s-1vcpu-1gb-tor1-01.ssh > 150.109.252.123.58566: Flags [.], ack 1047, win 502, options [nop,nop,TS val 554315783 ecr 1920326274], length 0
20:21:01.885650 IP lamponubuntu2204-s-1vcpu-1gb-tor1-01.ssh > 150.109.252.123.58566: Flags [P.], seq 1154:1686, ack 1047, win 502, options [nop,nop,TS val 554315792 ecr 1920326274], length 532
20:21:01.957664 IP 186-250-47-238.bvnetfibras.net.br.60630 > lamponubuntu2204-s-1vcpu-1gb-tor1-01.ssh: Flags [.], ack 1791, win 501, options [nop,nop,TS val 280101553 ecr 1869453990], length 0
20:21:02.073327 IP 150.109.252.123.58566 > lamponubuntu2204-s-1vcpu-1gb-tor1-01.ssh: Flags [.], ack 1686, win 263, options [nop,nop,TS val 1920326471 ecr 554315792], length 0
20:21:02.075928 IP 150.109.252.123.58566 > lamponubuntu2204-s-1vcpu-1gb-tor1-01.ssh: Flags [P.], seq 1047:1063, ack 1686, win 263, options [nop,nop,TS val 1920326473 ecr 554315792], length 16
20:21:02.117232 IP lamponubuntu2204-s-1vcpu-1gb-tor1-01.ssh > 150.109.252.123.58566: Flags [.], ack 1063, win 502, options [nop,nop,TS val 554316024 ecr 1920326473], length 0
20:21:02.304983 IP 150.109.252.123.58566 > lamponubuntu2204-s-1vcpu-1gb-tor1-01.ssh: Flags [P.], seq 1063:1115, ack 1686, win 263, options [nop,nop,TS val 1920326702 ecr 554316024], length 52
20:21:02.305030 IP lamponubuntu2204-s-1vcpu-1gb-tor1-01.ssh > 150.109.252.123.58566: Flags [.], ack 1115, win 502, options [nop,nop,TS val 554316211 ecr 1920326702], length 0
20:21:02.305177 IP lamponubuntu2204-s-1vcpu-1gb-tor1-01.ssh > 150.109.252.123.58566: Flags [P.], seq 1686:1738, ack 1115, win 502, options [nop,nop,TS val 554316212 ecr 1920326702], length 52
20:21:02.421964 IP lamponubuntu2204-s-1vcpu-1gb-tor1-01.56267 > 67.207.67.3.domain: 16897+ [1au] PTR? 180.191.99.167.in-addr.arpa. (56)
20:21:02.422381 IP 67.207.67.3.domain > lamponubuntu2204-s-1vcpu-1gb-tor1-01.56267: 16897 NXDomain 0/1/1 (123)
20:21:02.422451 IP lamponubuntu2204-s-1vcpu-1gb-tor1-01.56267 > 67.207.67.3.domain: 16897+ PTR? 180.191.99.167.in-addr.arpa. (45)
20:21:02.422751 IP 67.207.67.3.domain > lamponubuntu2204-s-1vcpu-1gb-tor1-01.56267: 16897 NXDomain 0/1/0 (112)
20:21:02.423641 IP lamponubuntu2204-s-1vcpu-1gb-tor1-01.43258 > 67.207.67.3.domain: 2357+ [1au] PTR? 3.67.207.67.in-addr.arpa. (53)
20:21:02.424129 IP 67.207.67.3.domain > lamponubuntu2204-s-1vcpu-1gb-tor1-01.43258: 2357 NXDomain 0/1/1 (120)
20:21:02.424341 IP lamponubuntu2204-s-1vcpu-1gb-tor1-01.60649 > 67.207.67.3.domain: 2536+ [1au] PTR? 3.67.207.67.in-addr.arpa. (53)
20:21:02.424458 IP lamponubuntu2204-s-1vcpu-1gb-tor1-01.43258 > 67.207.67.3.domain: 2357+ PTR? 3.67.207.67.in-addr.arpa. (42)
20:21:02.424788 IP 67.207.67.3.domain > lamponubuntu2204-s-1vcpu-1gb-tor1-01.43258: 2357 NXDomain 0/1/0 (109)
20:21:02.424986 IP 67.207.67.3.domain > lamponubuntu2204-s-1vcpu-1gb-tor1-01.60649: 2536 NXDomain 0/1/1 (120)
20:21:02.425095 IP lamponubuntu2204-s-1vcpu-1gb-tor1-01.60649 > 67.207.67.3.domain: 2536+ PTR? 3.67.207.67.in-addr.arpa. (42)
20:21:02.425451 IP 67.207.67.3.domain > lamponubuntu2204-s-1vcpu-1gb-tor1-01.60649: 2536 NXDomain 0/1/0 (109)
20:21:02.500803 IP 150.109.252.123.58566 > lamponubuntu2204-s-1vcpu-1gb-tor1-01.ssh: Flags [P.], seq 1115:1199, ack 1738, win 263, options [nop,nop,TS val 1920326898 ecr 554316212], length 84
20:21:02.506556 IP lamponubuntu2204-s-1vcpu-1gb-tor1-01.ssh > 150.109.252.123.58566: Flags [P.], seq 1738:1790, ack 1199, win 502, options [nop,nop,TS val 554316413 ecr 1920326898], length 52
20:21:02.631836 IP 198.96.85.163.60440 > lamponubuntu2204-s-1vcpu-1gb-tor1-01.ssh: Flags [P.], seq 336:372, ack 409, win 726, options [nop,nop,TS val 2588399762 ecr 301551008], length 36
20:21:02.632141 IP lamponubuntu2204-s-1vcpu-1gb-tor1-01.ssh > 198.96.85.163.60440: Flags [P.], seq 409:453, ack 372, win 501, options [nop,nop,TS val 301551998 ecr 2588399762], length 44
20:21:02.634569 IP 198.96.85.163.60440 > lamponubuntu2204-s-1vcpu-1gb-tor1-01.ssh: Flags [.], ack 453, win 726, options [nop,nop,TS val 2588399766 ecr 301551998], length 0
20:21:02.703870 IP 150.109.252.123.58566 > lamponubuntu2204-s-1vcpu-1gb-tor1-01.ssh: Flags [P.], seq 1199:1251, ack 1790, win 263, options [nop,nop,TS val 1920327101 ecr 554316413], length 52
20:21:02.703871 IP 150.109.252.123.58566 > lamponubuntu2204-s-1vcpu-1gb-tor1-01.ssh: Flags [F.], seq 1251, ack 1790, win 263, options [nop,nop,TS val 1920327101 ecr 554316413], length 0
20:21:02.707727 IP lamponubuntu2204-s-1vcpu-1gb-tor1-01.ssh > 150.109.252.123.58566: Flags [F.], seq 1790, ack 1252, win 502, options [nop,nop,TS val 554316614 ecr 1920327101], length 0
20:21:02.895405 IP 150.109.252.123.58566 > lamponubuntu2204-s-1vcpu-1gb-tor1-01.ssh: Flags [.], ack 1791, win 263, options [nop,nop,TS val 1920327293 ecr 554316614], length 0
20:21:03.007622 IP 198.96.85.163.60440 > lamponubuntu2204-s-1vcpu-1gb-tor1-01.ssh: Flags [P.], seq 372:408, ack 453, win 726, options [nop,nop,TS val 2588400135 ecr 301551998], length 36
20:21:03.007907 IP lamponubuntu2204-s-1vcpu-1gb-tor1-01.ssh > 198.96.85.163.60440: Flags [P.], seq 453:489, ack 408, win 501, options [nop,nop,TS val 301552374 ecr 2588400135], length 36
20:21:03.010461 IP 198.96.85.163.60440 > lamponubuntu2204-s-1vcpu-1gb-tor1-01.ssh: Flags [.], ack 489, win 726, options [nop,nop,TS val 2588400142 ecr 301552374], length 0
20:21:03.279657 IP 198.96.85.163.60440 > lamponubuntu2204-s-1vcpu-1gb-tor1-01.ssh: Flags [P.], seq 408:444, ack 489, win 726, options [nop,nop,TS val 2588400411 ecr 301552374], length 36
20:21:03.279935 IP lamponubuntu2204-s-1vcpu-1gb-tor1-01.ssh > 198.96.85.163.60440: Flags [P.], seq 489:525, ack 444, win 501, options [nop,nop,TS val 301552646 ecr 2588400411], length 36
20:21:03.282440 IP 198.96.85.163.60440 > lamponubuntu2204-s-1vcpu-1gb-tor1-01.ssh: Flags [.], ack 525, win 726, options [nop,nop,TS val 2588400414 ecr 301552646], length 0
20:21:04.115230 IP 198.96.85.163.60440 > lamponubuntu2204-s-1vcpu-1gb-tor1-01.ssh: Flags [P.], seq 444:480, ack 525, win 726, options [nop,nop,TS val 2588401245 ecr 301552646], length 36
20:21:04.115455 IP lamponubuntu2204-s-1vcpu-1gb-tor1-01.ssh > 198.96.85.163.60440: Flags [P.], seq 525:561, ack 480, win 501, options [nop,nop,TS val 301553482 ecr 2588401245], length 36
20:21:04.118649 IP 198.96.85.163.60440 > lamponubuntu2204-s-1vcpu-1gb-tor1-01.ssh: Flags [.], ack 561, win 726, options [nop,nop,TS val 2588401249 ecr 301553482], length 0
20:21:04.212513 IP 198.96.85.163.60440 > lamponubuntu2204-s-1vcpu-1gb-tor1-01.ssh: Flags [P.], seq 480:516, ack 561, win 726, options [nop,nop,TS val 2588401344 ecr 301553482], length 36
20:21:04.212845 IP lamponubuntu2204-s-1vcpu-1gb-tor1-01.ssh > 198.96.85.163.60440: Flags [P.], seq 561:597, ack 516, win 501, options [nop,nop,TS val 301553579 ecr 2588401344], length 36
20:21:04.215316 IP 198.96.85.163.60440 > lamponubuntu2204-s-1vcpu-1gb-tor1-01.ssh: Flags [.], ack 597, win 726, options [nop,nop,TS val 2588401347 ecr 301553579], length 0
20:21:04.770534 IP 198.96.85.163.60440 > lamponubuntu2204-s-1vcpu-1gb-tor1-01.ssh: Flags [P.], seq 516:552, ack 597, win 726, options [nop,nop,TS val 2588401900 ecr 301553579], length 36
20:21:04.770776 IP lamponubuntu2204-s-1vcpu-1gb-tor1-01.ssh > 198.96.85.163.60440: Flags [P.], seq 597:633, ack 552, win 501, options [nop,nop,TS val 301554137 ecr 2588401900], length 36
20:21:04.773295 IP 198.96.85.163.60440 > lamponubuntu2204-s-1vcpu-1gb-tor1-01.ssh: Flags [.], ack 633, win 726, options [nop,nop,TS val 2588401905 ecr 301554137], length 0
20:21:04.968110 IP 198.96.85.163.60440 > lamponubuntu2204-s-1vcpu-1gb-tor1-01.ssh: Flags [P.], seq 552:588, ack 633, win 726, options [nop,nop,TS val 2588402098 ecr 301554137], length 36
20:21:04.968363 IP lamponubuntu2204-s-1vcpu-1gb-tor1-01.ssh > 198.96.85.163.60440: Flags [P.], seq 633:669, ack 588, win 501, options [nop,nop,TS val 301554335 ecr 2588402098], length 36
20:21:04.970751 IP 198.96.85.163.60440 > lamponubuntu2204-s-1vcpu-1gb-tor1-01.ssh: Flags [.], ack 669, win 726, options [nop,nop,TS val 2588402102 ecr 301554335], length 0
20:21:05.148693 IP 198.96.85.163.60440 > lamponubuntu2204-s-1vcpu-1gb-tor1-01.ssh: Flags [P.], seq 588:624, ack 669, win 726, options [nop,nop,TS val 2588402278 ecr 301554335], length 36
20:21:05.148969 IP lamponubuntu2204-s-1vcpu-1gb-tor1-01.ssh > 198.96.85.163.60440: Flags [P.], seq 669:705, ack 624, win 501, options [nop,nop,TS val 301554515 ecr 2588402278], length 36
20:21:05.153458 IP 198.96.85.163.60440 > lamponubuntu2204-s-1vcpu-1gb-tor1-01.ssh: Flags [.], ack 705, win 726, options [nop,nop,TS val 2588402285 ecr 301554515], length 0
20:21:05.854527 IP 198.96.85.163.60440 > lamponubuntu2204-s-1vcpu-1gb-tor1-01.ssh: Flags [P.], seq 624:660, ack 705, win 726, options [nop,nop,TS val 2588402984 ecr 301554515], length 36
20:21:05.855073 IP lamponubuntu2204-s-1vcpu-1gb-tor1-01.ssh > 198.96.85.163.60440: Flags [P.], seq 705:749, ack 660, win 501, options [nop,nop,TS val 301555221 ecr 2588402984], length 44
20:21:05.857427 IP 198.96.85.163.60440 > lamponubuntu2204-s-1vcpu-1gb-tor1-01.ssh: Flags [.], ack 749, win 726, options [nop,nop,TS val 2588402989 ecr 301555221], length 0
20:21:06.151590 IP 198.96.85.163.60440 > lamponubuntu2204-s-1vcpu-1gb-tor1-01.ssh: Flags [P.], seq 660:696, ack 749, win 726, options [nop,nop,TS val 2588403281 ecr 301555221], length 36
20:21:06.151887 IP lamponubuntu2204-s-1vcpu-1gb-tor1-01.ssh > 198.96.85.163.60440: Flags [P.], seq 749:785, ack 696, win 501, options [nop,nop,TS val 301555518 ecr 2588403281], length 36
20:21:06.154217 IP 198.96.85.163.60440 > lamponubuntu2204-s-1vcpu-1gb-tor1-01.ssh: Flags [.], ack 785, win 726, options [nop,nop,TS val 2588403286 ecr 301555518], length 0
20:21:06.250233 IP 198.96.85.163.60440 > lamponubuntu2204-s-1vcpu-1gb-tor1-01.ssh: Flags [P.], seq 696:732, ack 785, win 726, options [nop,nop,TS val 2588403382 ecr 301555518], length 36
20:21:06.250526 IP lamponubuntu2204-s-1vcpu-1gb-tor1-01.ssh > 198.96.85.163.60440: Flags [P.], seq 785:821, ack 732, win 501, options [nop,nop,TS val 301555617 ecr 2588403382], length 36
20:21:06.252908 IP 198.96.85.163.60440 > lamponubuntu2204-s-1vcpu-1gb-tor1-01.ssh: Flags [.], ack 821, win 726, options [nop,nop,TS val 2588403384 ecr 301555617], length 0
20:21:06.486141 IP 198.96.85.163.60440 > lamponubuntu2204-s-1vcpu-1gb-tor1-01.ssh: Flags [P.], seq 732:768, ack 821, win 726, options [nop,nop,TS val 2588403616 ecr 301555617], length 36
20:21:06.486425 IP lamponubuntu2204-s-1vcpu-1gb-tor1-01.ssh > 198.96.85.163.60440: Flags [P.], seq 821:857, ack 768, win 501, options [nop,nop,TS val 301555853 ecr 2588403616], length 36
20:21:06.488882 IP 198.96.85.163.60440 > lamponubuntu2204-s-1vcpu-1gb-tor1-01.ssh: Flags [.], ack 857, win 726, options [nop,nop,TS val 2588403620 ecr 301555853], length 0
20:21:08.568809 IP lamponubuntu2204-s-1vcpu-1gb-tor1-01.36591 > 67.207.67.3.domain: 15141+ [1au] PTR? 238.47.250.186.in-addr.arpa. (56)
20:21:08.568941 IP lamponubuntu2204-s-1vcpu-1gb-tor1-01.58673 > 67.207.67.3.domain: 6274+ [1au] PTR? 238.47.250.186.in-addr.arpa. (56)
20:21:08.569179 IP 165.227.165.179.54536 > lamponubuntu2204-s-1vcpu-1gb-tor1-01.ssh: Flags [P.], seq 1510823460:1510823544, ack 887563003, win 501, options [nop,nop,TS val 1175108081 ecr 2486004867], length 84
20:21:08.574768 IP lamponubuntu2204-s-1vcpu-1gb-tor1-01.ssh > 165.227.165.179.54536: Flags [P.], seq 1:53, ack 84, win 502, options [nop,nop,TS val 2486004966 ecr 1175108081], length 52
20:21:08.668725 IP 165.227.165.179.54536 > lamponubuntu2204-s-1vcpu-1gb-tor1-01.ssh: Flags [P.], seq 84:136, ack 53, win 501, options [nop,nop,TS val 1175108180 ecr 2486004966], length 52
20:21:08.668725 IP 165.227.165.179.54536 > lamponubuntu2204-s-1vcpu-1gb-tor1-01.ssh: Flags [F.], seq 136, ack 53, win 501, options [nop,nop,TS val 1175108180 ecr 2486004966], length 0
20:21:08.671728 IP lamponubuntu2204-s-1vcpu-1gb-tor1-01.ssh > 165.227.165.179.54536: Flags [F.], seq 53, ack 137, win 502, options [nop,nop,TS val 2486005063 ecr 1175108180], length 0
20:21:08.747952 IP 67.207.67.3.domain > lamponubuntu2204-s-1vcpu-1gb-tor1-01.36591: 15141 1/0/1 PTR 186-250-47-238.bvnetfibras.net.br. (103)
20:21:08.749084 IP lamponubuntu2204-s-1vcpu-1gb-tor1-01.58228 > 67.207.67.3.domain: 8242+ [1au] PTR? 123.252.109.150.in-addr.arpa. (57)
20:21:08.749258 IP lamponubuntu2204-s-1vcpu-1gb-tor1-01.36397 > 67.207.67.3.domain: 27938+ [1au] PTR? 123.252.109.150.in-addr.arpa. (57)
20:21:08.770115 IP 165.227.165.179.54536 > lamponubuntu2204-s-1vcpu-1gb-tor1-01.ssh: Flags [.], ack 54, win 501, options [nop,nop,TS val 1175108281 ecr 2486005063], length 0
20:21:08.807424 IP 67.207.67.3.domain > lamponubuntu2204-s-1vcpu-1gb-tor1-01.36397: 27938 NXDomain 0/0/1 (57)
20:21:08.807568 IP lamponubuntu2204-s-1vcpu-1gb-tor1-01.36397 > 67.207.67.3.domain: 27938+ PTR? 123.252.109.150.in-addr.arpa. (46)
20:21:08.812267 IP 67.207.67.3.domain > lamponubuntu2204-s-1vcpu-1gb-tor1-01.58228: 8242 NXDomain 0/0/1 (57)
20:21:08.812562 IP lamponubuntu2204-s-1vcpu-1gb-tor1-01.58228 > 67.207.67.3.domain: 8242+ PTR? 123.252.109.150.in-addr.arpa. (46)
20:21:08.870459 IP 67.207.67.3.domain > lamponubuntu2204-s-1vcpu-1gb-tor1-01.36397: 27938 NXDomain 0/0/0 (46)
20:21:08.873394 IP 67.207.67.3.domain > lamponubuntu2204-s-1vcpu-1gb-tor1-01.58228: 8242 NXDomain 0/0/0 (46)
20:21:08.930876 IP 67.207.67.3.domain > lamponubuntu2204-s-1vcpu-1gb-tor1-01.58673: 6274 1/0/1 PTR 186-250-47-238.bvnetfibras.net.br. (103)
20:21:09.571012 IP 198.96.85.163.60440 > lamponubuntu2204-s-1vcpu-1gb-tor1-01.ssh: Flags [P.], seq 1056:1092, ack 1145, win 726, options [nop,nop,TS val 2588406702 ecr 301557920], length 36
20:21:09.571980 IP lamponubuntu2204-s-1vcpu-1gb-tor1-01.ssh > 198.96.85.163.60440: Flags [P.], seq 1145:1341, ack 1092, win 501, options [nop,nop,TS val 301558938 ecr 2588406702], length 196
20:21:09.574401 IP 198.96.85.163.60440 > lamponubuntu2204-s-1vcpu-1gb-tor1-01.ssh: Flags [.], ack 1341, win 749, options [nop,nop,TS val 2588406706 ecr 301558938], length 0
20:21:10.792924 IP 198.96.85.163.60440 > lamponubuntu2204-s-1vcpu-1gb-tor1-01.ssh: Flags [P.], seq 1092:1128, ack 1341, win 749, options [nop,nop,TS val 2588407923 ecr 301558938], length 36
20:21:10.793405 IP lamponubuntu2204-s-1vcpu-1gb-tor1-01.ssh > 198.96.85.163.60440: Flags [P.], seq 1341:1377, ack 1128, win 501, options [nop,nop,TS val 301560160 ecr 2588407923], length 36
20:21:10.800997 IP 198.96.85.163.60440 > lamponubuntu2204-s-1vcpu-1gb-tor1-01.ssh: Flags [.], ack 1377, win 749, options [nop,nop,TS val 2588407929 ecr 301560160], length 0
20:21:10.931513 IP 198.96.85.163.60440 > lamponubuntu2204-s-1vcpu-1gb-tor1-01.ssh: Flags [P.], seq 1128:1164, ack 1377, win 749, options [nop,nop,TS val 2588408061 ecr 301560160], length 36
20:21:10.931780 IP lamponubuntu2204-s-1vcpu-1gb-tor1-01.ssh > 198.96.85.163.60440: Flags [P.], seq 1377:1413, ack 1164, win 501, options [nop,nop,TS val 301560298 ecr 2588408061], length 36
20:21:10.934271 IP 198.96.85.163.60440 > lamponubuntu2204-s-1vcpu-1gb-tor1-01.ssh: Flags [.], ack 1413, win 749, options [nop,nop,TS val 2588408066 ecr 301560298], length 0
20:21:11.026196 IP 198.96.85.163.60440 > lamponubuntu2204-s-1vcpu-1gb-tor1-01.ssh: Flags [P.], seq 1164:1200, ack 1413, win 749, options [nop,nop,TS val 2588408157 ecr 301560298], length 36
20:21:11.029237 IP lamponubuntu2204-s-1vcpu-1gb-tor1-01.ssh > 198.96.85.163.60440: Flags [P.], seq 1413:1505, ack 1200, win 501, options [nop,nop,TS val 301560396 ecr 2588408157], length 92
20:21:11.029460 IP lamponubuntu2204-s-1vcpu-1gb-tor1-01.ssh > 198.96.85.163.60440: Flags [P.], seq 1505:1549, ack 1200, win 501, options [nop,nop,TS val 301560396 ecr 2588408157], length 44
20:21:11.029527 IP lamponubuntu2204-s-1vcpu-1gb-tor1-01.ssh > 198.96.85.163.60440: Flags [P.], seq 1549:1729, ack 1200, win 501, options [nop,nop,TS val 301560396 ecr 2588408157], length 180
20:21:11.031903 IP 198.96.85.163.60440 > lamponubuntu2204-s-1vcpu-1gb-tor1-01.ssh: Flags [.], ack 1505, win 749, options [nop,nop,TS val 2588408163 ecr 301560396], length 0
20:21:11.031904 IP 198.96.85.163.60440 > lamponubuntu2204-s-1vcpu-1gb-tor1-01.ssh: Flags [.], ack 1549, win 749, options [nop,nop,TS val 2588408163 ecr 301560396], length 0
20:21:11.031904 IP 198.96.85.163.60440 > lamponubuntu2204-s-1vcpu-1gb-tor1-01.ssh: Flags [.], ack 1729, win 772, options [nop,nop,TS val 2588408163 ecr 301560396], length 0
20:21:14.711335 IP lamponubuntu2204-s-1vcpu-1gb-tor1-01.43438 > 67.207.67.3.domain: 65228+ [1au] PTR? 179.165.227.165.in-addr.arpa. (57)
20:21:14.711500 IP lamponubuntu2204-s-1vcpu-1gb-tor1-01.39837 > 67.207.67.3.domain: 3796+ [1au] PTR? 179.165.227.165.in-addr.arpa. (57)
20:21:14.712251 IP 67.207.67.3.domain > lamponubuntu2204-s-1vcpu-1gb-tor1-01.43438: 65228 NXDomain 0/1/1 (124)
20:21:14.712251 IP 67.207.67.3.domain > lamponubuntu2204-s-1vcpu-1gb-tor1-01.39837: 3796 NXDomain 0/1/1 (124)
20:21:14.712458 IP lamponubuntu2204-s-1vcpu-1gb-tor1-01.43438 > 67.207.67.3.domain: 65228+ PTR? 179.165.227.165.in-addr.arpa. (46)
20:21:14.712526 IP lamponubuntu2204-s-1vcpu-1gb-tor1-01.39837 > 67.207.67.3.domain: 3796+ PTR? 179.165.227.165.in-addr.arpa. (46)
20:21:14.712799 IP 67.207.67.3.domain > lamponubuntu2204-s-1vcpu-1gb-tor1-01.43438: 65228 NXDomain 0/1/0 (113)
20:21:14.712905 IP 67.207.67.3.domain > lamponubuntu2204-s-1vcpu-1gb-tor1-01.39837: 3796 NXDomain 0/1/0 (113)
20:21:14.784064 IP 198.96.85.163.60440 > lamponubuntu2204-s-1vcpu-1gb-tor1-01.ssh: Flags [P.], seq 1560:1596, ack 2133, win 772, options [nop,nop,TS val 2588411914 ecr 301563933], length 36
20:21:14.789046 IP lamponubuntu2204-s-1vcpu-1gb-tor1-01.ssh > 198.96.85.163.60440: Flags [P.], seq 2133:2177, ack 1596, win 501, options [nop,nop,TS val 301564155 ecr 2588411914], length 44
20:21:14.791412 IP 198.96.85.163.60440 > lamponubuntu2204-s-1vcpu-1gb-tor1-01.ssh: Flags [.], ack 2177, win 772, options [nop,nop,TS val 2588411923 ecr 301564155], length 0
20:21:14.815810 IP 43.163.246.113.49320 > lamponubuntu2204-s-1vcpu-1gb-tor1-01.ssh: Flags [P.], seq 1678659019:1678659103, ack 3512331763, win 263, options [nop,nop,TS val 721783989 ecr 4098510353], length 84
20:21:14.821460 IP lamponubuntu2204-s-1vcpu-1gb-tor1-01.ssh > 43.163.246.113.49320: Flags [P.], seq 1:53, ack 84, win 502, options [nop,nop,TS val 4098510538 ecr 721783989], length 52
20:21:15.004352 IP 43.163.246.113.49320 > lamponubuntu2204-s-1vcpu-1gb-tor1-01.ssh: Flags [P.], seq 84:136, ack 53, win 263, options [nop,nop,TS val 721784178 ecr 4098510538], length 52
20:21:15.004352 IP 43.163.246.113.49320 > lamponubuntu2204-s-1vcpu-1gb-tor1-01.ssh: Flags [F.], seq 136, ack 53, win 263, options [nop,nop,TS val 721784178 ecr 4098510538], length 0
20:21:15.007558 IP lamponubuntu2204-s-1vcpu-1gb-tor1-01.ssh > 43.163.246.113.49320: Flags [F.], seq 53, ack 137, win 502, options [nop,nop,TS val 4098510724 ecr 721784178], length 0
20:21:15.024016 IP 198.96.85.163.60440 > lamponubuntu2204-s-1vcpu-1gb-tor1-01.ssh: Flags [P.], seq 1596:1632, ack 2177, win 772, options [nop,nop,TS val 2588412154 ecr 301564155], length 36
20:21:15.025238 IP lamponubuntu2204-s-1vcpu-1gb-tor1-01.ssh > 198.96.85.163.60440: Flags [P.], seq 2177:2229, ack 1632, win 501, options [nop,nop,TS val 301564392 ecr 2588412154], length 52
20:21:15.025961 IP lamponubuntu2204-s-1vcpu-1gb-tor1-01.ssh > 198.96.85.163.60440: Flags [P.], seq 2229:2297, ack 1632, win 501, options [nop,nop,TS val 301564392 ecr 2588412154], length 68
20:21:15.026085 IP lamponubuntu2204-s-1vcpu-1gb-tor1-01.ssh > 198.96.85.163.60440: Flags [P.], seq 2297:2333, ack 1632, win 501, options [nop,nop,TS val 301564392 ecr 2588412154], length 36
20:21:15.026491 IP lamponubuntu2204-s-1vcpu-1gb-tor1-01.ssh > 198.96.85.163.60440: Flags [P.], seq 2333:2377, ack 1632, win 501, options [nop,nop,TS val 301564393 ecr 2588412154], length 44
20:21:15.026564 IP lamponubuntu2204-s-1vcpu-1gb-tor1-01.ssh > 198.96.85.163.60440: Flags [P.], seq 2377:2557, ack 1632, win 501, options [nop,nop,TS val 301564393 ecr 2588412154], length 180
20:21:15.028041 IP 198.96.85.163.60440 > lamponubuntu2204-s-1vcpu-1gb-tor1-01.ssh: Flags [.], ack 2229, win 772, options [nop,nop,TS val 2588412159 ecr 301564392], length 0
20:21:15.028330 IP 198.96.85.163.60440 > lamponubuntu2204-s-1vcpu-1gb-tor1-01.ssh: Flags [.], ack 2297, win 772, options [nop,nop,TS val 2588412159 ecr 301564392], length 0
20:21:15.028330 IP 198.96.85.163.60440 > lamponubuntu2204-s-1vcpu-1gb-tor1-01.ssh: Flags [.], ack 2333, win 772, options [nop,nop,TS val 2588412159 ecr 301564392], length 0
20:21:15.029222 IP 198.96.85.163.60440 > lamponubuntu2204-s-1vcpu-1gb-tor1-01.ssh: Flags [.], ack 2377, win 772, options [nop,nop,TS val 2588412160 ecr 301564393], length 0
20:21:15.029222 IP 198.96.85.163.60440 > lamponubuntu2204-s-1vcpu-1gb-tor1-01.ssh: Flags [.], ack 2557, win 794, options [nop,nop,TS val 2588412160 ecr 301564393], length 0
20:21:15.183019 IP 43.163.246.113.49320 > lamponubuntu2204-s-1vcpu-1gb-tor1-01.ssh: Flags [.], ack 54, win 263, options [nop,nop,TS val 721784356 ecr 4098510724], length 0
20:21:15.603232 IP 74.208.119.157.50828 > lamponubuntu2204-s-1vcpu-1gb-tor1-01.ssh: Flags [S], seq 1575193677, win 64240, options [mss 1460,sackOK,TS val 3586706123 ecr 0,nop,wscale 7], length 0
20:21:15.603334 IP lamponubuntu2204-s-1vcpu-1gb-tor1-01.ssh > 74.208.119.157.50828: Flags [S.], seq 2321285815, ack 1575193678, win 65160, options [mss 1460,sackOK,TS val 1439824415 ecr 3586706123,nop,wscale 7], length 0
20:21:15.631627 IP 74.208.119.157.50828 > lamponubuntu2204-s-1vcpu-1gb-tor1-01.ssh: Flags [.], ack 1, win 502, options [nop,nop,TS val 3586706152 ecr 1439824415], length 0
20:21:15.631627 IP 74.208.119.157.50828 > lamponubuntu2204-s-1vcpu-1gb-tor1-01.ssh: Flags [P.], seq 1:23, ack 1, win 502, options [nop,nop,TS val 3586706152 ecr 1439824415], length 22: SSH: SSH-2.0-libssh_0.9.6
20:21:15.631723 IP lamponubuntu2204-s-1vcpu-1gb-tor1-01.ssh > 74.208.119.157.50828: Flags [.], ack 23, win 509, options [nop,nop,TS val 1439824443 ecr 3586706152], length 0
20:21:15.645999 IP lamponubuntu2204-s-1vcpu-1gb-tor1-01.ssh > 74.208.119.157.50828: Flags [P.], seq 1:42, ack 23, win 509, options [nop,nop,TS val 1439824457 ecr 3586706152], length 41: SSH: SSH-2.0-OpenSSH_8.9p1 Ubuntu-3ubuntu0.6
20:21:15.673672 IP 74.208.119.157.50828 > lamponubuntu2204-s-1vcpu-1gb-tor1-01.ssh: Flags [.], ack 42, win 502, options [nop,nop,TS val 3586706194 ecr 1439824457], length 0
20:21:15.673732 IP lamponubuntu2204-s-1vcpu-1gb-tor1-01.ssh > 74.208.119.157.50828: Flags [P.], seq 42:1154, ack 23, win 509, options [nop,nop,TS val 1439824485 ecr 3586706194], length 1112
20:21:15.673768 IP 74.208.119.157.50828 > lamponubuntu2204-s-1vcpu-1gb-tor1-01.ssh: Flags [P.], seq 23:999, ack 42, win 502, options [nop,nop,TS val 3586706194 ecr 1439824457], length 976
20:21:15.717224 IP lamponubuntu2204-s-1vcpu-1gb-tor1-01.ssh > 74.208.119.157.50828: Flags [.], ack 999, win 502, options [nop,nop,TS val 1439824529 ecr 3586706194], length 0
20:21:15.743043 IP 74.208.119.157.50828 > lamponubuntu2204-s-1vcpu-1gb-tor1-01.ssh: Flags [.], ack 1154, win 501, options [nop,nop,TS val 3586706263 ecr 1439824485], length 0
20:21:15.744979 IP 74.208.119.157.50828 > lamponubuntu2204-s-1vcpu-1gb-tor1-01.ssh: Flags [P.], seq 999:1047, ack 1154, win 501, options [nop,nop,TS val 3586706265 ecr 1439824529], length 48
20:21:15.745012 IP lamponubuntu2204-s-1vcpu-1gb-tor1-01.ssh > 74.208.119.157.50828: Flags [.], ack 1047, win 502, options [nop,nop,TS val 1439824556 ecr 3586706265], length 0
20:21:15.752425 IP lamponubuntu2204-s-1vcpu-1gb-tor1-01.ssh > 74.208.119.157.50828: Flags [P.], seq 1154:1686, ack 1047, win 502, options [nop,nop,TS val 1439824564 ecr 3586706265], length 532
20:21:15.780159 IP 74.208.119.157.50828 > lamponubuntu2204-s-1vcpu-1gb-tor1-01.ssh: Flags [.], ack 1686, win 501, options [nop,nop,TS val 3586706300 ecr 1439824564], length 0
20:21:15.780227 IP 74.208.119.157.50828 > lamponubuntu2204-s-1vcpu-1gb-tor1-01.ssh: Flags [P.], seq 1047:1063, ack 1686, win 501, options [nop,nop,TS val 3586706300 ecr 1439824564], length 16
20:21:15.821228 IP lamponubuntu2204-s-1vcpu-1gb-tor1-01.ssh > 74.208.119.157.50828: Flags [.], ack 1063, win 502, options [nop,nop,TS val 1439824633 ecr 3586706300], length 0
20:21:15.848911 IP 74.208.119.157.50828 > lamponubuntu2204-s-1vcpu-1gb-tor1-01.ssh: Flags [P.], seq 1063:1115, ack 1686, win 501, options [nop,nop,TS val 3586706369 ecr 1439824633], length 52
20:21:15.848958 IP lamponubuntu2204-s-1vcpu-1gb-tor1-01.ssh > 74.208.119.157.50828: Flags [.], ack 1115, win 502, options [nop,nop,TS val 1439824660 ecr 3586706369], length 0
20:21:15.849079 IP lamponubuntu2204-s-1vcpu-1gb-tor1-01.ssh > 74.208.119.157.50828: Flags [P.], seq 1686:1738, ack 1115, win 502, options [nop,nop,TS val 1439824660 ecr 3586706369], length 52
20:21:15.876816 IP 74.208.119.157.50828 > lamponubuntu2204-s-1vcpu-1gb-tor1-01.ssh: Flags [P.], seq 1115:1199, ack 1738, win 501, options [nop,nop,TS val 3586706397 ecr 1439824660], length 84
20:21:15.882469 IP lamponubuntu2204-s-1vcpu-1gb-tor1-01.ssh > 74.208.119.157.50828: Flags [P.], seq 1738:1790, ack 1199, win 502, options [nop,nop,TS val 1439824694 ecr 3586706397], length 52
